organization,repo_name,language,stars,forks,open_issues,age_days,description,has_coc,has_contributing,has_workflows,homepage,topics,license,last_updated
"huihut","interview","C++",37994,8093,3,3060,"📚 C/C++ 技术面试基础知识总结，包括语言、程序库、数据结构、算法、系统、网络、链接装载库等知识及面试经验、招聘、内推等信息。This repository is a summary of the basic knowledge of recruiting job seekers and beginners in the direction of C/C++ technology, including language, program library, data structure, algorithm, system, network, link loading library, interview experience, recruitment, recommendation, etc.",true,true,true,"https://interview.huihut.com","algorithm|c|cpp|data-structures|database|interview|interview-practice|interview-preparation|interview-questions|interviews|leetcode|operating-system|stl","Other",307
"YunaiV","ruoyi-vue-pro","Java",37977,8226,3,1980,"🔥 官方推荐 🔥 RuoYi-Vue 全新 Pro 版本，优化重构所有功能。基于 Spring Boot + MyBatis Plus + Vue & Element 实现的后台管理系统 + 微信小程序，支持 RBAC 动态权限、数据权限、SaaS 多租户、Flowable 工作流、三方登录、支付、短信、商城、CRM、ERP、MES、IM、AI 大模型、IoT 物联网等功能。你的 ⭐️ Star ⭐️，是作者生发的动力！",true,true,true,"https://doc.iocoder.cn/","flowable|mybatis-plus|mysql|redis|redisson|spring-security|springboot|vue","MIT License",0
"portainer","portainer","TypeScript",37832,2849,752,3691,"Making Docker and Kubernetes management easy.",true,true,true,"https://www.portainer.io","docker|docker-compose|docker-container|docker-deployment|docker-image|docker-swarm|docker-ui|dockerfile|hacktoberfest|kubernetes|moby|portainer|ui","zlib License",1
"sqlmapproject","sqlmap","Python",37760,6304,51,5114,"Automatic SQL injection and database takeover tool",true,true,true,"http://sqlmap.org","api-security|appsec|database|database-security|dbms|detection|exploitation|pentesting|python|security-testing|security-testing-tool|sql-injection|sqlinjection|webapp-security|webappsec","Other",0
"FreeCodeCampChina","freecodecamp.cn","CSS",37722,1417,159,3557,"FCC China open source codebase and curriculum. Learn to code and help nonprofits.",true,true,true,"https://fcc.asia/","career|certification|cn-freecodecamp|community|curriculum|d3|education|freecodecamp|javascript|learn-to-code|math|nodejs|nonprofits|react","Other",1077
"aseprite","aseprite","C++",37671,8235,1971,4330,"Animated sprite editor & pixel art tool (Windows, macOS, Linux)",true,true,true,"https://www.aseprite.org","animated-sprites|animation|aseprite|c-plus-plus|cpp|draw|gif|graphics|pixel-art|pixel-editor|sprite-editor|sprites|spritesheet|tile-editor|tilemap-editor","No License",2
"ajeetdsouza","zoxide","Rust",37669,834,156,2305,"A smarter cd command. Supports all major shells.",true,false,true,"https://crates.io/crates/zoxide","autojump|bash|cli|command-line|command-line-tool|elvish|fasd|fish|fish-shell|fzf|hacktoberfest|jump|nushell|powershell|rust|shell|xonsh|xontrib|z|zsh","MIT License",4
"vlang","v","V",37661,2249,37,2696,"Simple, fast, safe, compiled language for developing maintainable software. Compiles itself in <1s with zero library dependencies. Supports automatic C => V translation. https://vlang.io",true,true,true,"","compiler|language|programming-language|v","MIT License",0
"docker","compose","Go",37649,5767,104,4583,"Define and run multi-container applications with Docker",true,false,true,"https://docs.docker.com/compose/","docker|docker-compose|go|golang|orchestration","Apache License 2.0",1
"denysdovhan","wtfjs","JavaScript",37632,2690,45,3270,"🤪 A list of funny and tricky JavaScript examples",true,false,true,"http://bit.ly/wtfjavascript","book|handbook|javascript|js|learning|notes|specification|wtf","Do What The F*ck You Want To Public License",466
"NervJS","taro","TypeScript",37567,4887,1737,3002,"开放式跨端跨框架解决方案，支持使用 React/Vue 等框架来开发微信/京东/百度/支付宝/字节跳动/ QQ 小程序/H5/React Native 等应用。  https://taro.zone/",true,true,true,"https://docs.taro.zone/","javascript|jquery|nerv|nervjs|react|react-native|reactjs|taro|typescript|vue|vue3|wechat|wechat-mini-program|weixin|wxapp","Other",4
"TencentARC","GFPGAN","Python",37481,6275,404,1926,"GFPGAN aims at developing Practical Algorithms for Real-world Face Restoration.",true,true,true,"","deep-learning|face-restoration|gan|gfpgan|image-restoration|pytorch|super-resolution","Other",701
"drawdb-io","drawdb","JavaScript",37471,3038,224,1077,"Free, simple, and intuitive online database diagram editor and SQL generator.",true,true,true,"https://drawdb.app","database-schema|diagram-editor|editor|erd|erdiagram|indexeddb|javascript|mariadb|oracle-database|oracle-db|postgresql|react|sql|sql-server|sqlite|svg|tailwindcss","GNU Affero General Public License v3.0",1
"alibaba","arthas","Java",37403,7629,484,2859,"Alibaba Java Diagnostic Tool Arthas/Alibaba Java诊断利器Arthas",true,true,true,"https://arthas.aliyun.com/","agent|alibaba|arthas|classloader|diagnosis|java|jvm|trace|trouble-shooting","Apache License 2.0",1
"ueberdosis","tiptap","TypeScript",37400,3038,896,2868,"The headless rich text editor framework for web artisans.",true,true,true,"https://tiptap.dev","editor|javascript|js|prosemirror|react|renderless-components|rich-text|tiptap|vue|wysiwyg|wysiwyg-editor","MIT License",1
"LAION-AI","Open-Assistant","Python",37393,3276,298,1292,"OpenAssistant is a chat-based assistant that understands tasks, can interact with third-party systems, and retrieve information dynamically to do so.",true,true,true,"https://open-assistant.io","ai|assistant|chatgpt|discord-bot|language-model|machine-learning|nextjs|python|rlhf","Apache License 2.0",679
"karpathy","LLM101n","Unknown",37388,2053,19,762,"LLM101n: Let's build a Storyteller",false,false,true,"","","No License",695
"umami-software","umami","TypeScript",37377,7389,123,2171,"Umami is a modern, privacy-focused analytics platform. An open-source alternative to Google Analytics, Mixpanel and Amplitude.",true,true,true,"https://umami.is","analytics|audience-segmentation|charts|cohort-analysis|google-analytics|product-analytics|statistics|user-journey|web-analytics","MIT License",1
"vercel-labs","agent-browser","Rust",37354,2398,542,167,"Browser automation CLI for AI agents",true,true,true,"https://agent-browser.dev","","Apache License 2.0",1
"bytedance","UI-TARS-desktop","TypeScript",37344,3764,406,524,"The Open-Source Multimodal AI Agent Stack: Connecting Cutting-Edge AI Models and Agent Infra",true,true,true,"https://agent-tars.com","agent|agent-tars|browser-use|computer-use|cowork|gui-agent|gui-operator|mcp|mcp-server|multimodal|tars|ui-tars|vision|vlm","Apache License 2.0",9
"xyflow","xyflow","TypeScript",37342,2459,124,2539,"React Flow | Svelte Flow - Powerful open source libraries for building node-based UIs with React (https://reactflow.dev) or Svelte (https://svelteflow.dev). Ready out-of-the-box and infinitely customizable.",true,true,true,"https://xyflow.com","flowchart|graph|javascript|node-based-ui|react|react-flow|svelte|svelte-flow|typescript|typescript-library|workflow","MIT License",2
"eugenp","tutorials","Java",37333,53458,23,4807,"Getting Started with Spring Boot 3: ",true,true,true,"https://bit.ly/github-ls","","MIT License",1
"Alishahryar1","free-claude-code","Python",37294,5860,351,150,"Use claude code and codex for free in the terminal, VSCode extension, and discord like OpenClaw (voice supported)",true,true,true,"","","MIT License",0
"exacity","deeplearningbook-chinese","TeX",37289,9129,67,3489,"Deep Learning Book Chinese Translation",true,true,true,"https://exacity.github.io/deeplearningbook-chinese","","No License",2398
"wshobson","agents","Python",37260,4008,4,338,"Multi-harness agentic plugin marketplace for Claude Code, Codex CLI, Cursor, OpenCode, GitHub Copilot, and Gemini CLI",true,true,true,"https://sethhobson.com","agent-skills|agentic-ai|agents|ai-agents|anthropic|automation|claude-code|claude-code-plugins|codex-cli|copilot|cursor|cursor-rules|developer-tools|gemini-cli|mcp|multi-agent|opencode|orchestration|prompt-engineering|workflows","MIT License",2
"openai","gym","Python",37237,8699,128,3713,"A toolkit for developing and comparing reinforcement learning algorithms.",true,true,true,"https://www.gymlibrary.dev","","Other",93
"0voice","interview_internal_reference","Python",37236,9363,35,2574,"2025年最新总结，阿里，腾讯，百度，美团，头条等技术面试题目，以及答案，专家出题人分析汇总。",true,true,true,"","cpu|high-performance|interview|mongodb|mysql|network|nginx|redis|storage|zookeeper","No License",248
"fengdu78","Coursera-ML-AndrewNg-Notes","HTML",37230,11182,68,3157,"吴恩达老师的机器学习课程个人笔记",true,true,true,"","coursera|machine-learning","No License",306
"servo","servo","Rust",37207,3686,3130,5253,"Servo aims to empower developers with a lightweight, high-performance alternative for embedding web technologies in applications.",true,true,true,"https://servo.org","browser|rust|servo|web|webbrowser|webengine|webplatform","Mozilla Public License 2.0",0
"PKUanonym","REKCARC-TSC-UHT","HTML",37207,7837,4,2640,"清华大学计算机系课程攻略 Guidance for courses in Department of Computer Science and Technology, Tsinghua University",true,true,true,"https://rekcarc-tsc-uht.readthedocs.io/","computer-science|course|course-assignment|course-project|tsinghua-university","Creative Commons Attribution Share Alike 4.0 International",2
"alebcay","awesome-shell","Unknown",37171,2535,170,4373,"A curated list of awesome command-line frameworks, toolkits, guides and gizmos. Inspired by awesome-php.",true,true,true,"","awesome|awesome-list|bash|cli|fish|list|shell|zsh","Creative Commons Zero v1.0 Universal",303
"HKUDS","LightRAG","Python",37085,5228,218,633,"[EMNLP2025] ""LightRAG: Simple and Fast Retrieval-Augmented Generation""",true,true,true,"https://arxiv.org/abs/2410.05779","genai|gpt|gpt-4|graphrag|knowledge-graph|large-language-models|llm|rag|retrieval-augmented-generation","MIT License",1
"Yeachan-Heo","oh-my-claudecode","TypeScript",37076,3349,0,169,"Teams-first Multi-agent orchestration for Claude Code",true,true,true,"https://oh-my-claudecode.dev","agentic-coding|ai-agents|automation|claude|claude-code|multi-agent-systems|oh-my-opencode|opencode|parallel-execution|vibe-coding","MIT License",0
"harness","harness","Go",37032,3236,105,4523,"Harness Open Source is an end-to-end developer platform with Source Control Management, CI/CD Pipelines, Hosted Developer Environments, and Artifact Registries.",true,true,true,"https://www.harness.io/open-source","build-automation|build-pipelines|ci|ci-cd|code-repository|continuous-delivery|continuous-integration|docker|git|go|hacktoberfest|scm","Apache License 2.0",1
"satwikkansal","wtfpython","Python",37011,2668,71,3225,"What the f*ck Python? 😱",true,true,true,"","documentation|gotchas|interview-questions|pitfalls|python|python-interview-questions|snippets|wats|wtf","Do What The F*ck You Want To Public License",165
"google","langextract","Python",36964,2552,107,354,"A Python library for extracting structured information from unstructured text using LLMs with precise source grounding and interactive visualization.",true,true,true,"https://pypi.org/project/langextract/","gemini|gemini-ai|gemini-api|gemini-flash|gemini-pro|information-extration|large-language-models|llm|nlp|python|structured-data","Apache License 2.0",37
"AobingJava","JavaFamily","Unknown",36963,7771,6,2419,"【Java面试+Java学习指南】 一份涵盖大部分Java程序员所需要掌握的核心知识。",true,true,true,"","interview|java|java8|jvm|mysql|redis|rocketmq|system|zookeeper","No License",236
"markedjs","marked","JavaScript",36933,3552,16,5452,"A markdown parser and compiler. Built for speed.",true,true,true,"https://marked.js.org","commonmark|compiler|gfm|hacktoberfest|markdown|parser","Other",4
"huggingface","pytorch-image-models","Python",36917,5170,63,2702,"The largest collection of PyTorch image encoders / backbones. Including train, eval, inference, export scripts, and pretrained weights -- ResNet, ResNeXT, EfficientNet, NFNet, Vision Transformer (ViT), MobileNetV4, MobileNet-V3 & V2, RegNet, DPN, CSPNet, Swin Transformer, MaxViT, CoAtNet, ConvNeXt, and more",true,true,true,"https://huggingface.co/docs/timm","augmix|convnext|distributed-training|efficientnet|image-classification|imagenet|maxvit|mixnet|mobile-deep-learning|mobilenet-v2|mobilenetv3|nfnets|normalization-free-training|optimizer|pretrained-models|pretrained-weights|pytorch|randaugment|resnet|vision-transformer-models","Apache License 2.0",2
"babysor","MockingBird","Python",36908,5204,482,1785,"🚀Clone a voice in 5 seconds to generate arbitrary speech in real-time",true,true,true,"","ai|deep-learning|pytorch|speech|text-to-speech|tts","Other",116
"myshell-ai","OpenVoice","Python",36796,4104,307,941,"Instant voice cloning by MIT and MyShell. Audio foundation model.",true,true,true,"https://research.myshell.ai/open-voice","text-to-speech|tts|voice-clone|zero-shot-tts","MIT License",434
"anthropics","prompt-eng-interactive-tutorial","Jupyter Notebook",36733,4007,66,816,"Anthropic's Interactive Prompt Engineering Tutorial",true,true,true,"","","No License",118
"shadowsocks","shadowsocks-android","Kotlin",36699,11479,75,4941,"A shadowsocks client for Android",true,true,true,"","android|shadowsocks","Other",15
"pbatard","rufus","C",36638,3099,10,5334,"The Reliable USB Formatting Utility",true,true,true,"https://rufus.ie","bios|boot|bootable-drives|freedos|gpt|grub|grub4dos|iso|mbr|md5|persistence|rufus|secure-boot|sha1|sha256|syslinux|uefi|usb|windows|windows-to-go","GNU General Public License v3.0",5
"aquasecurity","trivy","Go",36629,500,236,2635,"Find vulnerabilities, misconfigurations, secrets, SBOM in containers, Kubernetes, code repositories, clouds and more",true,true,true,"https://trivy.dev","containers|devsecops|docker|go|golang|hacktoberfest|iac|infrastructure-as-code|kubernetes|misconfiguration|security|security-tools|vulnerability|vulnerability-detection|vulnerability-scanners","Apache License 2.0",2
"TriliumNext","Trilium","TypeScript",36618,2458,667,3323,"Build your personal knowledge base with Trilium Notes",true,false,true,"https://triliumnotes.org","electron|electron-app|knowledge-base|knowledge-graph|knowledge-management|knowledge-management-graph|local-first|note-managment|note-taker|note-taking|notebook|notes|notes-app|personal-knowledge-base|personal-wiki|scriptable|self-hosted|self-hosting|wiki","GNU Affero General Public License v3.0",0
"inkonchain","docs","MDX",36616,463,64,781,"Ink Documentation",true,false,false,"https://docs.inkonchain.com","","No License",43
"fastify","fastify","JavaScript",36591,2750,154,3559,"Fast and low overhead web framework, for Node.js",true,false,true,"https://www.fastify.dev","hacktoberfest|nodejs|performance|speed|webframework","MIT License",2
"date-fns","date-fns","TypeScript",36587,1968,939,4282,"⏳ Modern JavaScript date utility library ⌛️",true,false,true,"https://date-fns.org","date|date-fns|hacktoberfest|javascript|modules|nodejs|time|utilities","No License",19
"rohitg00","ai-engineering-from-scratch","Python",36585,6025,89,101,"Learn it. Build it. Ship it for others.",true,true,true,"https://aiengineeringfromscratch.com","agents|ai|ai-agents|ai-engineering|computer-vision|course|deep-learning|from-scratch|generative-ai|llm|machine-learning|mcp|nlp|python|reinforcement-learning|rust|swarm-intelligence|transformers|tutorial|typescript","MIT License",2
"inkonchain","node","Shell",36559,635,24,775,"How to run an Ink Node",true,false,false,"https://docs.inkonchain.com","","MIT License",67
"typeorm","typeorm","TypeScript",36558,6609,545,3771,"TypeScript & JavaScript ORM for Node.js — supports PostgreSQL, MySQL, MariaDB, SQLite, SQL Server, Oracle, and more.",true,false,true,"http://typeorm.io","active-record|cockroachdb|data-mapper|database|hacktoberfest|javascript|mariadb|mysql|orm|postgresql|sqlite|sqlserver|typeorm|typescript","MIT License",1
"DioxusLabs","dioxus","Rust",36546,1703,696,1989,"Fullstack app framework for web, desktop, and mobile.",true,true,true,"https://dioxuslabs.com","android|css|desktop|html|ios|native|react|rust|ssr|ui|virtualdom|wasm|web","Apache License 2.0",5
"hyprwm","Hyprland","C++",36527,1814,200,1564,"Hyprland is an independent, highly customizable, dynamic tiling Wayland compositor that doesn't sacrifice on its looks.",true,true,true,"https://hypr.land","compositor|cpp26|wayland|wayland-compositor","BSD 3-Clause ""New"" or ""Revised"" License",0
"datalab-to","marker","Python",36480,2526,427,971,"Convert PDF to markdown + JSON quickly with high accuracy",true,true,true,"https://www.datalab.to","","GNU General Public License v3.0",5
"inkonchain","ink-kit","TypeScript",36474,430,3,600,"React component library for onchain applications - See README for modern alternatives",true,false,false,"https://ink-kit.inkonchain.com","","MIT License",250
"hankcs","HanLP","Python",36432,10932,12,4279,"中文分词 词性标注 命名实体识别 依存句法分析 成分句法分析 语义依存分析 语义角色标注 指代消解 风格转换 语义相似度 新词发现 关键词短语提取 自动摘要 文本分类聚类 拼音简繁转换 自然语言处理",true,true,true,"https://www.hanlp.com/","dependency-parser|hanlp|named-entity-recognition|natural-language-processing|nlp|pos-tagging|semantic-parsing|text-classification","Apache License 2.0",224
"open-guides","og-aws","Shell",36429,3892,159,3636,"📙 Amazon Web Services — a practical guide",true,true,true,"","","Creative Commons Attribution 4.0 International",680
"Textualize","textual","Python",36397,1231,293,1906,"The lean application framework for Python.  Build sophisticated user interfaces with a simple Python API. Run your apps in the terminal and a web browser.",true,true,true,"https://textual.textualize.io/","cli|framework|python|rich|terminal|tui","MIT License",2
"jaywcjlove","linux-command","Markdown",36360,6598,82,3514,"Linux命令大全搜索工具，内容包含Linux命令手册、详解、学习、搜集。https://git.io/linux",true,false,true,"https://jaywcjlove.github.io/linux-command","bash|chrome|chrome-extension|command-line|gh-pages|linux|linux-command|ls|screen|screenshot|search|ssh|tools|web-tools","MIT License",5
"directus","directus","TypeScript",36323,4806,385,4945,"The flexible backend for all your projects 🐰 Turn your DB into a headless CMS, admin panels, or apps with a custom UI, instant APIs, auth & more.",true,true,true,"https://directus.com","api|app|cms|composable|data-visualization|database|directus|graphql|headless-cms|javascript|mariadb|mssql|mysql|no-code|node|postgresql|sql|sqlite|typescript|vue","Other",0
"veggiemonk","awesome-docker","Unknown",36322,3327,20,4297,":whale: A curated list of Docker resources and projects",true,false,true,"https://average.joe.dev/awesome-docker/","awesome|awesome-list|container|docker|docker-api|docker-container|docker-deployment|docker-environment|docker-image|docker-machine|docker-monitoring|docker-registry|docker-security|docker-swarm|dockerfile|list|moby|tools","Apache License 2.0",3
"SheetJS","sheetjs","Unknown",36278,7945,132,4954,"📗 SheetJS Spreadsheet Data Toolkit -- New home https://git.sheetjs.com/SheetJS/sheetjs",true,false,true,"https://sheetjs.com/","angular|bun|csv|data|database|deno|excel|grid|html|html5|ios|javascript|json|nodejs|react|spreadsheet|table|vue|xlsx|xml","Apache License 2.0",800
"formulahendry","955.WLB","Unknown",36270,1742,202,2649,"955 不加班的公司名单 - 工作 955，work–life balance (工作与生活的平衡)",true,true,true,"","","No License",509
"reworkd","AgentGPT","TypeScript",36230,9309,219,1177,"🤖 Assemble, configure, and deploy autonomous AI Agents in your browser.",true,false,true,"https://agentgpt.reworkd.ai","agent|agentgpt|agents|agi|ai|ai-agents|autogpt|baby-agi|gpt|langchain|llm|next|openai|t3|t3-stack","GNU General Public License v3.0",424
"doocs","leetcode","Java",36219,9454,15,2841,"🔥LeetCode solutions in any programming language | 多种编程语言实现 LeetCode、《剑指 Offer（第 2 版）》、《程序员面试金典（第 6 版）》题解",true,false,true,"https://leetcode.doocs.org","algorithms|cpp|csharp|golang|java|javascript|leetcode|python3","Creative Commons Attribution Share Alike 4.0 International",0
"mouredev","Hello-Python","Python",36177,2313,35,1424,"Curso para aprender el lenguaje de programación Python desde cero y para principiantes. 100 clases, 44 horas en vídeo, código, proyectos y grupo de chat. Fundamentos, frontend, backend, testing, IA...",true,true,true,"https://mouredev.link/python","backend|chatgpt|chatgpt-api|fastapi|frontend|gpt-3|gpt-4|mongodb|openai|openai-api|python|python3|reflex|tutorial","Apache License 2.0",320
"RVC-Project","Retrieval-based-Voice-Conversion-WebUI","Python",36175,5103,741,1188,"Easily train a good VC model with voice data <= 10 mins!",true,true,true,"","audio-analysis|change|conversational-ai|conversion|converter|retrieval-model|retrieve-data|rvc|so-vits-svc|sovits|vc|vits|voice|voice-conversion|voice-converter|voiceconversion","MIT License",580
"patchy631","ai-engineering-hub","Jupyter Notebook",36133,5993,116,614,"In-depth tutorials on LLMs, RAGs and real-world AI agent applications.",true,true,true,"https://join.dailydoseofds.com","agents|ai|llms|machine-learning|mcp|rag","MIT License",19
"frappe","erpnext","Python",36127,11859,1931,5498,"Free and Open Source Enterprise Resource Planning (ERP)",true,true,true,"https://frappe.io/erpnext","accounting|asset-management|crm|distribution|erp|erpnext|frappe|healthcare|hrms|manufacturing|point-of-sale|procurement|project-management|python|retail|support","GNU General Public License v3.0",0
"GorvGoyl","Clone-Wars","Unknown",36126,3247,36,2033,"100+ open-source clones of popular sites like Airbnb, Amazon, Instagram, Netflix, Tiktok, Spotify, Whatsapp, Youtube etc. See source code, demo links, tech stack, github stars.",true,true,true,"https://gourav.io/clone-wars","airbnb|clone|instagram|netflix|reddit|spotify|tiktok|twitter|whatsapp","GNU Affero General Public License v3.0",690
"slatedocs","slate","Unknown",36078,363,50,4670,"Beautiful static documentation for your API",true,false,true,"https://slatedocs.github.io/slate","api|api-documentation|slate|static-site-generator","No License",146
"geekxh","hello-algorithm","Java",36077,6415,11,2220,"🌍 针对小白的算法训练 | 包括四部分：①.大厂面经 ②.力扣图解  ③.千本开源电子书 ④.百张技术思维导图（项目花了上百小时，希望可以点 star 支持，🌹感谢~）推荐免费ChatGPT使用网站",true,true,true,"https://www.lintcode.com/chat-gpt?utm_source=tf-github-xhGPT","algorithms|dynamic-programming|interview-questions|leetcode|leetcode-solutions","No License",1110
"lerna","lerna","TypeScript",36059,2272,316,3858,"Lerna is a fast, modern build system for managing and publishing multiple JavaScript/TypeScript packages from the same repository.",true,false,true,"https://lerna.js.org","lerna|monorepo|npm|package|publishing","MIT License",3
"carbon-app","carbon","JavaScript",36037,1975,83,3298,":black_heart: Create and share beautiful images of your source code",true,false,true,"https://carbon.now.sh","beautiful|carbon|education|github-gist|javascript|presentation|sharing|snippets|tweet","MIT License",137
"1Panel-dev","1Panel","Go",36013,3227,303,1439,"🔥 1Panel is a modern, open-source VPS control panel — and the only one with native AI agent support. Run Ollama models, deploy OpenClaw agents, and manage your entire server stack from one clean web interface.",true,false,true,"https://1panel.pro","agent|clawdbot|copaw|docker|docker-ui|hermes|hermes-agent|linux|lnmp|ollama|openclaw|openresty|qwenpaw|webmin","GNU General Public License v3.0",1
"nextcloud","server","PHP",35950,5035,3396,3677,"☁️ Nextcloud server, a safe home for all your data",true,true,true,"https://nextcloud.com","cloud|collaboration|decentralized|design|distributed|enterprise|federation|file-sharing|free-software|hacktoberfest|javascript|nextcloud|open-source|opensource|owncloud|php|self-hosting|sharing|usability|ux","GNU Affero General Public License v3.0",0
"xinntao","Real-ESRGAN","Python",35933,4391,640,1804,"Real-ESRGAN aims at developing Practical Algorithms for General Image/Video Restoration.",true,true,true,"","amine|denoise|esrgan|image-restoration|jpeg-compression|pytorch|real-esrgan|super-resolution","BSD 3-Clause ""New"" or ""Revised"" License",690
"jax-ml","jax","Python",35921,3663,2470,2802,"Composable transformations of Python+NumPy programs: differentiate, vectorize, JIT to GPU/TPU, and more",true,false,true,"https://docs.jax.dev","jax","Apache License 2.0",0
"langchain-ai","langgraph","Python",35901,6009,588,1053,"Build resilient agents.",true,true,true,"https://docs.langchain.com/oss/python/langgraph/","agents|ai|ai-agents|chatgpt|deepagents|enterprise|framework|gemini|generative-ai|langchain|langgraph|llm|multiagent|open-source|openai|pydantic|python|rag","MIT License",0
"google-ai-edge","mediapipe","C++",35854,6039,583,2571,"Cross-platform, customizable ML solutions for live and streaming media.",true,true,true,"https://ai.google.dev/edge/mediapipe","android|audio-processing|c-plus-plus|calculator|computer-vision|deep-learning|framework|graph-based|graph-framework|inference|machine-learning|mediapipe|mobile-development|perception|pipeline-framework|stream-processing|video-processing","Apache License 2.0",0
