organization,repo_name,language,stars,forks,open_issues,age_days,description,has_coc,has_contributing,has_workflows
"FoundationAgents","MetaGPT","Python",66358,8378,101,1002,"🌟 The Multi-Agent Framework: First AI Software Company, Towards Natural Language Programming",true,true,true
"leonardomso","33-js-concepts","JavaScript",66303,9192,2,2762,"📜 33 JavaScript concepts every developer should know.",true,true,true
"NationalSecurityAgency","ghidra","Java",66257,7301,1864,2584,"Ghidra is a software reverse engineering (SRE) framework",true,true,true
"labmlai","annotated_deep_learning_paper_implementations","Python",66172,6649,29,2041,"🧑‍🏫 60+ Implementations/tutorials of deep learning papers with side-by-side notes 📝; including transformers (original, xl, switch, feedback, vit, ...), optimizers (adam, adabelief, sophia, ...), gans(cyclegan, stylegan2, ...), 🎮 reinforcement learning (ppo, dqn), capsnet, distillation, ... 🧠",true,true,true
"TapXWorld","ChinaTextbook","Roff",66116,14741,98,2274,"所有小初高、大学PDF教材。",true,true,true
"apache","echarts","TypeScript",66037,19826,1744,4742,"Apache ECharts is a powerful, interactive charting and data visualization library for browser",true,true,true
"webpack","webpack","JavaScript",65990,9360,204,5131,"A bundler for javascript and friends. Packs many modules into a few bundled assets. Code Splitting allows for loading parts of the application on demand. Through ""loaders"", modules can be CommonJs, AMD, ES6 modules, CSS, Images, JSON, Coffeescript, LESS, ... and your custom stuff.",true,true,true
"xtekky","gpt4free","Python",65939,13649,6,1094,"The official gpt4free repository | various collection of powerful language models | opus 4.6 gpt 5.3 kimi 2.5 deepseek v3.2 gemini 3",true,true,true
"scikit-learn","scikit-learn","Python",65528,26856,2142,5702,"scikit-learn: machine learning in Python",true,true,true
"sindresorhus","awesome-nodejs","Unknown",65442,6203,28,4278,":zap: Delightful Node.js packages and resources [BECAUSE OF TOO MUCH SPAM AND LOW-QUALITY SUBMISSIONS, SUBMISSIONS ARE PAUSED UNTIL SEPTEMBER]",true,false,true
"lydiahallie","javascript-questions","Unknown",65305,9237,50,2481,"A long list of (advanced) JavaScript questions, and their explanations :sparkles:  ",true,true,true
"TheAlgorithms","Java","Java",65283,21042,57,3542,"All Algorithms implemented in Java",true,false,true
"bradtraversy","design-resources-for-developers","Unknown",65116,11996,3,2151,"Curated list of design and UI resources from stock photos, web templates, CSS frameworks, UI libraries, tools and much more",true,true,true
"kelseyhightower","nocode","Dockerfile",65105,4830,4699,2971,"The best way to write secure and reliable applications. Write nothing; deploy nowhere.",true,true,true
"kdn251","interviews","Java",64911,12922,118,3328,"Everything you need to know to get the job.",true,true,true
"localstack","localstack","Python",64831,4660,0,3440,"💻 A fully functional local AWS cloud stack. Develop and test your cloud & Serverless apps offline",true,true,true
"chrislgarry","Apollo-11","Assembly",64709,7387,126,4376,"Original Apollo 11 Guidance Computer (AGC) source code for the command and lunar modules.",true,true,true
"msitarzewski","agency-agents","Shell",64683,9760,84,166,"A complete AI agency at your fingertips - From frontend wizards to Reddit community ninjas, from whimsy injectors to reality checkers. Each agent is a specialized expert with personality, processes, and proven deliverables.",true,true,true
"facebook","docusaurus","TypeScript",64297,9790,362,3202,"Easy to maintain open source documentation websites.",true,true,true
"keras-team","keras","Python",63913,19742,316,4018,"Deep Learning for humans",true,true,true
"OpenBB-finance","OpenBB","Python",63671,6273,73,1924,"Financial data platform for analysts, quants and AI agents.",true,true,true
"prometheus","prometheus","Go",63291,10273,760,4872,"The Prometheus monitoring system and time series database.",true,true,true
"alacritty","alacritty","Rust",63152,3365,335,3691,"A cross-platform, OpenGL terminal emulator.",true,false,true
"socketio","socket.io","TypeScript",62989,10153,206,5860,"Realtime application framework (Node.JS server)",true,true,true
"pathwaycom","pathway","Python",62915,1628,31,1217,"Python ETL framework for stream processing, real-time analytics, LLM pipelines, and RAG.",true,false,true
"openinterpreter","open-interpreter","Python",62888,5422,310,988,"A natural language interface for computers",true,false,true
"resume","resume.github.com","JavaScript",62825,1368,71,5529,"Resumes generated using the GitHub informations",true,true,true
"unclecode","crawl4ai","Python",62777,6402,46,688,"🚀🤖 Crawl4AI: Open-source LLM Friendly Web Crawler & Scraper. Don't be shy, join here: https://discord.gg/jP8KfhDhyN",true,true,true
"nocodb","nocodb","TypeScript",62541,4694,659,3071,"🔥 🔥 🔥 A Free & Self-hostable Airtable Alternative",true,true,true
"traefik","traefik","Go",62382,5893,777,3848,"The Cloud Native Application Proxy",true,true,false
"gorhill","uBlock","JavaScript",62372,3988,17,4013,"uBlock Origin - An efficient blocker for Chromium and Firefox. Fast and lean.",true,true,true
"rust-lang","rustlings","Rust",62314,11172,84,3847,":crab: Small exercises to get you used to reading and writing Rust code!",true,false,true
"ryanoasis","nerd-fonts","CSS",62226,3871,63,4131,"Iconic font aggregator, collection, & patcher. 3,600+ icons, 50+ patched fonts: Hack, Source Code Pro, more. Glyph collections: Font Awesome, Material Design Icons, Octicons, & more",true,true,true
"FuelLabs","sway","Rust",61844,5426,892,1893,"🌴 Empowering everyone to build reliable and efficient smart contracts.",true,false,true
"tldr-pages","tldr","Markdown",61822,5134,274,4493,"Collaborative cheatsheets for console commands 📚.",true,true,true
"lodash","lodash","JavaScript",61578,7125,134,5103,"A modern JavaScript utility library delivering modularity, performance, & extras.",true,true,true
"LadybirdBrowser","ladybird","C++",61524,2888,647,667,"Truly independent web browser",true,false,true
"BurntSushi","ripgrep","Rust",61506,2446,140,3669,"ripgrep recursively searches directories for a regex pattern while respecting your gitignore",true,false,true
"reduxjs","redux","TypeScript",61455,15114,41,3955,"A JS library for predictable global state management",true,false,true
"atom","atom","JavaScript",60999,17258,994,5180,":atom: The hackable text editor",true,false,true
"scrapy","scrapy","Python",60973,11402,647,5878,"Scrapy, a fast high-level web crawling & scraping framework for Python.",true,true,false
"youngyangyang04","leetcode-master","Shell",60898,12333,242,2296,"《代码随想录》LeetCode 刷题攻略：200道经典题目刷题顺序，共60w字的详细图解，视频难点剖析，50余张思维导图，支持C++，Java，Python，Go，JavaScript等多语言版本，从此算法学习不再迷茫！🔥🔥 来看看，你会发现相见恨晚！🚀 ",true,true,true
"xingshaocheng","architect-awesome","Unknown",60831,17763,63,2913,"后端架构师技术图谱",true,true,true
"h5bp","Front-end-Developer-Interview-Questions","Nunjucks",60819,11063,52,5160,"A list of helpful front-end related questions you can use to interview potential candidates, test yourself or completely ignore.",true,false,true
"minio","minio","Go",60568,7323,80,4090,"MinIO is a high-performance, S3 compatible object store, open sourced under GNU AGPLv3 license.",true,false,true
"commaai","openpilot","Python",60443,10741,245,3411,"openpilot is an operating system for robotics. Currently, it upgrades the driver assistance system on 300+ supported cars.",true,true,true
"adam-p","markdown-here","JavaScript",60174,11097,319,5067,"Google Chrome, Firefox, and Thunderbird extension that lets you write email in Markdown and render it before sending.",true,true,true
"Asabeneh","30-Days-Of-Python","Python",60156,11474,102,2320,"The 30 Days of Python programming challenge is a step-by-step guide to learn the Python programming language in 30 days. This challenge may take more than 100 days. Follow your own pace. These videos may help too: https://www.youtube.com/channel/UC7PNRuno1rzYPb1xLa4yktw",true,true,true
"jgraph","drawio-desktop","JavaScript",60077,5634,64,3228,"Official electron build of draw.io",true,true,true
"git","git","C",59970,27708,361,6456,"Git Source Code Mirror - This is a publish-only repository but pull requests can be turned into patches to the mailing list via GitGitGadget (https://gitgitgadget.github.io/). Please follow Documentation/SubmittingPatches procedure for any of your improvements.",false,false,true
"nuxt","nuxt","TypeScript",59920,5578,924,3440,"The Full-Stack Vue Framework.",true,true,true
"jquery","jquery","JavaScript",59869,20472,96,6202,"jQuery JavaScript Library",true,false,false
"spring-projects","spring-framework","Java",59782,38902,365,5589,"Spring Framework",true,false,true
"cline","cline","TypeScript",59572,6059,697,630,"Autonomous coding agent right in your IDE, capable of creating/editing files, executing commands, using the browser, and more with your permission every step of the way.",true,true,true
"CorentinJ","Real-Time-Voice-Cloning","Python",59571,9419,170,2498,"Clone a voice in 5 seconds to generate arbitrary speech in real-time",true,false,true
"topjohnwu","Magisk","Kotlin",59561,17080,53,3488,"The Magic Mask for Android",true,false,true
"pathwaycom","llm-app","Jupyter Notebook",59485,1409,9,983,"Ready-to-run cloud templates for RAG, AI pipelines, and enterprise search with live data. 🐳Docker-friendly.⚡Always in sync with Sharepoint, Google Drive, S3, Kafka, PostgreSQL, real-time data APIs, and more.",true,true,true
"Solido","awesome-flutter","Dart",59421,6867,26,3247,"An awesome list that curates the best Flutter libraries, tools, tutorials, articles and more.",false,false,true
"shadowsocks","shadowsocks-windows","C#",59283,16284,199,4821,"A C# port of shadowsocks",true,true,true
"meta-llama","llama","Python",59274,9827,516,1138,"Inference code for Llama models",true,true,true
"karpathy","autoresearch","Python",59079,8189,157,21,"AI agents running research on single-GPU nanochat training automatically",true,true,true
"angular","angular.js","JavaScript",58892,27206,461,5925,"AngularJS - HTML enhanced for web apps!",true,true,true
"PlexPt","awesome-chatgpt-prompts-zh","Unknown",58846,13557,44,1202,"ChatGPT 中文调教指南。各种场景使用指南。学习怎么让它听你的话。",true,true,true
"unslothai","unsloth","Python",58500,4940,1038,849,"Unsloth Studio is a web UI for training and running open models like Qwen, DeepSeek, gpt-oss and Gemma locally.",true,false,true
"FFmpeg","FFmpeg","C",58388,13630,3,5461,"Mirror of https://git.ffmpeg.org/ffmpeg.git",false,false,true
"FiloSottile","mkcert","Go",58346,3050,165,2833,"A simple zero-config tool to make locally trusted development certificates with any names you'd like.",true,false,true
"rails","rails","Ruby",58321,22181,1533,6560,"Ruby on Rails",true,false,true
"usememos","memos","Go",58284,4219,33,1570,"Open-source, self-hosted note-taking tool built for quick capture. Markdown-native, lightweight, and fully yours.",true,false,true
"withastro","astro","TypeScript",57929,3280,267,1838,"The web framework for content-driven websites. ⭐️ Star to support our work!",true,true,true
"sharkdp","bat","Rust",57829,1494,343,2898,"A cat(1) clone with wings.",true,false,true
"pmndrs","zustand","TypeScript",57555,2005,4,2545,"🐻 Bear necessities for state management in React",true,true,true
"dani-garcia","vaultwarden","Rust",57477,2665,51,2960,"Unofficial Bitwarden compatible server written in Rust, formerly known as bitwarden_rs",true,false,true
"opendatalab","MinerU","Python",57436,4755,190,758,"Transforms complex documents like PDFs into LLM-ready markdown/JSON for your Agentic workflows.",true,true,true
"h5bp","html5-boilerplate","JavaScript",57416,12302,12,5906,"A professional front-end template for building fast, robust, and adaptable web apps or sites.",true,false,true
"scutan90","DeepLearning-500-questions","JavaScript",57262,15963,121,2831,"深度学习500问，以问答形式对常用的概率知识、线性代数、机器学习、深度学习、计算机视觉等热点问题进行阐述，以帮助自己及有需要的读者。 全书分为18个章节，50余万字。由于水平有限，书中不妥之处恳请广大读者批评指正。   未完待续............ 如有意合作，联系scutjy2015@163.com                     版权所有，违权必究       Tan 2018.06",true,true,true
"FuelLabs","fuel-core","Rust",57244,2862,191,2038,"Rust full node implementation of the Fuel v2 protocol.",true,false,true
"zylon-ai","private-gpt","Python",57200,7613,293,1061,"Interact with your documents using the power of GPT, 100% privately, no data leaks",true,true,true
"pocketbase","pocketbase","Go",57184,3223,24,1362,"Open Source realtime backend in 1 file",true,false,true
"ultralytics","yolov5","Python",57094,17447,44,2140,"YOLOv5 🚀 in PyTorch > ONNX > CoreML > TFLite",true,true,true
"Mintplex-Labs","anything-llm","JavaScript",56943,6158,300,1028,"The all-in-one AI productivity accelerator. On device and privacy first with no annoying setup or configuration.",true,true,true
"soimort","you-get","Python",56837,9769,381,4967,":arrow_double_down: Dumb downloader that scrapes the web",false,true,true
"meilisearch","meilisearch","Rust",56809,2453,280,2896,"A lightning-fast search engine API bringing AI-powered hybrid search to your sites and applications.",true,true,true
"docling-project","docling","Python",56648,3850,866,627,"Get your documents ready for gen AI",true,true,true
"rust-unofficial","awesome-rust","Rust",56413,3255,12,4272,"A curated list of Rust code and resources.",true,false,true
"remix-run","react-router","TypeScript",56336,10839,160,4333,"Declarative routing for React",true,false,true
"microsoft","autogen","Python",56320,8462,714,953,"A programming framework for agentic AI",true,true,true
"rclone","rclone","Go",56313,4999,1160,4394,"""rsync for cloud storage"" - Google Drive, S3, Dropbox, Backblaze B2, One Drive, Swift, Hubic, Wasabi, Google Cloud Storage, Azure Blob, Azure Files, Yandex Files",true,true,true
"pi-hole","pi-hole","Shell",56310,3001,54,4310,"A black hole for Internet advertisements",true,true,true
"ageitgey","face_recognition","Python",56245,13703,831,3311,"The world's simplest facial recognition api for Python and the command line",true,true,true
"RVC-Boss","GPT-SoVITS","Python",56185,6135,869,803,"1 min voice data can also be used to train a good TTS model! (few shot voice cloning)",true,true,true
"gatsbyjs","gatsby","JavaScript",55955,10215,366,3963,"React-based framework with performance, scalability, and security built in.",true,true,true
"Textualize","rich","Python",55903,2079,310,2329,"Rich is a Python library for rich text and beautiful formatting in the terminal.",true,true,true
"tiimgreen","github-cheat-sheet","Unknown",55900,5407,43,4367,"A list of cool features of Git and GitHub.",true,true,true
"azl397985856","leetcode","JavaScript",55814,9437,10,2920,"LeetCode Solutions: A Record of My Problem Solving Journey.( leetcode题解，记录自己的leetcode解题之路。)",true,true,true
"wasabeef","awesome-android-ui","Unknown",55743,10276,38,4112,"A curated list of awesome Android UI/UX libraries",true,true,true
"karpathy","nanoGPT","Python",55716,9499,339,1186,"The simplest, fastest repository for training/finetuning medium-sized GPTs.",true,true,true
"golang-standards","project-layout","Makefile",55655,5437,98,3121,"Standard Go Project Layout",true,true,true
"FoundationAgents","OpenManus","Python",55531,9699,527,386,"No fortress, purely open ground.  OpenManus is Coming.",true,true,true
"Z4nzu","hackingtool","Python",55494,6044,49,2177,"ALL IN ONE Hacking Tool For Hackers",true,true,true
"starship","starship","Rust",55464,2436,1003,2552,"☄🌌️  The minimal, blazing-fast, and infinitely customizable prompt for any shell!",true,false,true
"appwrite","appwrite","TypeScript",55303,5133,759,2545,"Appwrite® - complete cloud infrastructure for your web, mobile and AI apps. Including Auth, Databases, Storage, Functions, Messaging, Hosting, Realtime and more",true,true,true
"AntonOsika","gpt-engineer","Python",55233,7310,68,1064,"CLI platform to experiment with codegen. Precursor to: https://lovable.dev",true,true,true
"microsoft","ai-agents-for-beginners","Jupyter Notebook",55202,19064,12,485,"12 Lessons to Get Started Building AI Agents",true,true,true
"ultralytics","ultralytics","Python",55124,10594,317,1293,"Ultralytics YOLO 🚀",true,true,true
"deepfakes","faceswap","Python",55085,13411,4,3021,"Deepfakes Software For All",true,true,true
"marktext","marktext","JavaScript",54736,4066,1416,3057,"📝A simple and elegant markdown editor, available for Linux, macOS and Windows.",true,true,true
"go-gitea","gitea","Go",54545,6502,2873,3434,"Git with a cup of tea! Painless self-hosted all-in-one software development service, including Git hosting, code review, team collaboration, package registry and CI/CD",true,false,true
"lencx","ChatGPT","Rust",54369,6190,925,1207,"🔮 ChatGPT Desktop Application (Mac, Windows and Linux)",true,false,true
"ElemeFE","element","Vue",54186,14519,2967,3493,"A Vue.js 2.0 UI Toolkit for Web",true,true,true
"laurent22","joplin","TypeScript",54110,6019,609,3357,"Joplin - the privacy-focused note taking app with sync capabilities for Windows, macOS, Linux, Android and iOS.",true,false,true
"maybe-finance","maybe","Ruby",54052,5473,0,816,"The personal finance app for everyone",false,false,true
"psf","requests","Python",53853,9805,286,5521,"A simple, yet elegant, HTTP library.",true,false,true
"facebookresearch","segment-anything","Jupyter Notebook",53786,6299,592,1100,"The repository provides code for running inference with the SegmentAnything Model (SAM), links for downloading the trained model checkpoints, and example notebooks that show how to use the model.",true,true,true
"necolas","normalize.css","CSS",53766,10450,74,5442,"A modern alternative to CSS resets",true,false,true
"harry0703","MoneyPrinterTurbo","Python",53703,7596,238,747,"利用AI大模型，一键生成高清短视频 Generate short videos with one click using AI LLM.",true,true,true
"wagoodman","dive","Go",53668,1968,201,2875,"A tool for exploring each layer in a docker image",true,true,true
"romkatv","powerlevel10k","Shell",53493,2396,140,2588,"A Zsh theme",true,false,true
"vuejs","core","TypeScript",53342,9071,977,2846,"🖖 Vue.js is a progressive, incrementally-adoptable JavaScript framework for building UI on the web.",true,true,true
"garrytan","gstack","TypeScript",53326,6879,247,16,"Use Garry Tan's exact Claude Code setup: 15 opinionated tools that serve as CEO, Designer, Eng Manager, Release Manager, Doc Engineer, and QA",true,true,true
"ngosang","trackerslist","Unknown",53317,6625,6,3625,"Updated list of public BitTorrent trackers",true,false,true
"Zie619","n8n-workflows","Python",53295,6924,21,318,"all of the workflows of n8n i could find (also from the site itself)",true,true,true
"cloudcommunity","Free-Certifications","Unknown",53250,3519,69,2066,"A curated list of free courses with certifications. Also available at https://free-certifications.com/",true,false,true
"nextlevelbuilder","ui-ux-pro-max-skill","Python",53234,5143,67,118,"An AI SKILL that provide design intelligence for building professional UI/UX multiple platforms",true,true,true
"firstcontributions","first-contributions","Unknown",53197,100307,262,3475,"🚀✨ Help beginners to contribute to open source projects",true,true,true
"mozilla","pdf.js","JavaScript",53049,10606,469,5450,"PDF Reader in JavaScript",true,true,true
"google","material-design-icons","Unknown",53026,9726,401,4188,"Material Design icons by Google (Material Symbols)",true,true,false
"WerWolv","ImHex","C++",52995,2343,334,1963,"🔍 A Hex Editor for Reverse Engineers, Programmers and people who value their retinas when working at 3 AM.",true,true,true
"2dust","v2rayNG","Kotlin",52889,7085,10,2509,"A V2Ray client for Android, support Xray core and v2fly core",true,true,true
"termux","termux-app","Java",52588,6293,509,3809,"Termux - a terminal emulator application for Android OS extendible by variety of packages.",true,false,true
"JetBrains","kotlin","Kotlin",52516,6272,227,5156,"The Kotlin Programming Language. ",false,false,true
"ionic-team","ionic-framework","TypeScript",52423,13386,622,4602,"A powerful cross-platform UI toolkit for building native-quality iOS, Android, and Progressive Web Apps with HTML, CSS, and JavaScript.",true,true,true
"sickcodes","Docker-OSX","Shell",52353,2908,415,2123,"Run macOS VM in a Docker! Run near native OSX-KVM in Docker! X11 Forwarding! CI/CD for OS X Security Research! Docker mac Containers.",true,true,true
"typst","typst","Rust",52298,1516,1161,2376,"A markup-based typesetting system that is powerful and easy to learn.",true,false,true
"coollabsio","coolify","PHP",52297,3917,696,1887,"An open-source, self-hostable PaaS alternative to Vercel, Heroku & Netlify that lets you easily deploy static sites, databases, full-stack applications and 280+ one-click services on your own servers.",true,false,true
"PowerShell","PowerShell","C#",52177,8237,1432,3726,"PowerShell for every system!",true,true,true
"TryGhost","Ghost","JavaScript",52172,11395,363,4711,"Independent technology for modern publishing, memberships, subscriptions and newsletters.",true,false,true
"prettier","prettier","JavaScript",51738,4689,1465,3405,"Prettier is an opinionated code formatter.",true,true,true
"etcd-io","etcd","Go",51697,10341,216,4647,"Distributed reliable key-value store for the most critical data of a distributed system",true,false,true
"vsouza","awesome-ios","Swift",51635,6960,19,4278,"A curated list of awesome iOS ecosystem, including Objective-C and Swift Projects ",true,false,true
"xai-org","grok-1","Python",51527,8468,125,741,"Grok open release",false,true,true
"google","guava","Java",51512,11155,726,4320,"Google core libraries for Java",true,true,true
"jekyll","jekyll","Ruby",51497,10294,242,6368,":globe_with_meridians: Jekyll is a blog-aware static site generator in Ruby",true,true,true
"mem0ai","mem0","Python",51317,5741,271,1012,"Universal memory layer for AI Agents",true,true,true
"FlowiseAI","Flowise","TypeScript",51171,23992,823,1093,"Build AI Agents, Visually",true,true,true
"chinese-poetry","chinese-poetry","JavaScript",51165,10335,130,3494,"The most comprehensive database of Chinese poetry 🧶最全中华古诗词数据库,  唐宋两朝近一万四千古诗人,  接近5.5万首唐诗加26万宋诗.  两宋时期1564位词人，21050首词。",true,false,true
"agalwood","Motrix","JavaScript",51162,4835,775,2657,"A full-featured download manager.",true,true,true
"Semantic-Org","Semantic-UI","JavaScript",51122,4891,1074,4736,"Semantic is a UI component framework based around useful principles from natural language.",true,true,true
"DefinitelyTyped","DefinitelyTyped","TypeScript",51118,30563,698,4921,"The repository for high quality TypeScript type definitions.",true,true,true
"ethereum","go-ethereum","Go",50967,21884,384,4475,"Go implementation of the Ethereum protocol",true,true,true
"upstash","context7","TypeScript",50877,2405,175,366,"Context7 Platform -- Up-to-date code documentation for LLMs and AI code editors",true,false,true
"bytedance","deer-flow","Python",50845,6079,385,325,"An open-source long-horizon SuperAgent harness that researches, codes, and creates. With the help of sandboxes, memories, tools, skill, subagents and message gateway, it handles different levels of tasks that could take minutes to hours.",true,true,true
"dockur","windows","Shell",50752,4164,117,804,"Windows inside a Docker container.",true,false,true
"charlax","professional-programming","Python",50693,3970,1,3794,"A collection of learning resources for curious software engineers",true,true,true
"justjavac","awesome-wechat-weapp","Unknown",50683,9003,2,3473,"微信小程序开发资源汇总 :100:",false,false,true
"karpathy","nanochat","Python",50537,6623,84,166,"The best ChatGPT that $100 can buy.",true,true,true
"poteto","hiring-without-whiteboards","JavaScript",50524,3882,38,3300,"⭐️  Companies that don't have a broken hiring process",false,false,true
"ChrisTitusTech","winutil","PowerShell",50426,2718,18,1430,"Chris Titus Tech's Windows Utility - Install Programs, Tweaks, Fixes, and Updates",true,true,true
"jesseduffield","lazydocker","Go",50414,1591,266,2506,"The lazier way to manage everything docker",true,true,true
"Avik-Jain","100-Days-Of-ML-Code","Unknown",50110,11382,66,2823,"100 Days of ML Coding",false,true,true
"jgthms","bulma","CSS",50068,3904,521,3716,"Modern CSS framework based on Flexbox",true,true,true
"sansan0","TrendRadar","Python",49878,22803,34,334,"⭐AI-driven public opinion & trend monitor with multi-platform aggregation, RSS, and smart alerts.🎯 告别信息过载，你的 AI 舆情监控助手与热点筛选工具！聚合多平台热点 +  RSS 订阅，支持关键词精准筛选。AI 智能筛选新闻 + AI 翻译 +  AI 分析简报直推手机，也支持接入 MCP 架构，赋能 AI 自然语言对话分析、情感洞察与趋势预测等。支持 Docker ，数据本地/云端自持。集成微信/飞书/钉钉/Telegram/邮件/ntfy/bark/slack 等渠道智能推送。",true,false,true
"odoo","odoo","Python",49789,31922,9444,4336,"Odoo. Open Source Apps To Grow Your Business.",true,false,true
"mastodon","mastodon","Ruby",49787,7421,4442,3686,"Your self-hosted, globally interconnected microblogging community",true,true,true
"jellyfin","jellyfin","C#",49718,4578,894,2666,"The Free Software Media System - Server Backend & API",true,true,true
"virattt","ai-hedge-fund","Python",49630,8622,89,483,"An AI Hedge Fund Team",true,true,true
