organization,repo_name,language,stars,forks,open_issues,age_days,description,has_coc,has_contributing,has_workflows
"cypress-io","cypress","TypeScript",49615,3400,1216,4042,"Fast, easy and reliable testing for anything that runs in a browser.",true,false,true
"lyswhut","lx-music-desktop","TypeScript",49612,6669,1107,2417,"一个基于 Electron 的音乐软件",true,false,true
"NARKOZ","hacker-scripts","JavaScript",49448,6662,69,3779,"Based on a true story",true,false,true
"dkhamsing","open-source-ios-apps","Unknown",49402,5745,1,4078,":iphone: Collaborative List of Open-Source iOS Apps",true,false,true
"dbeaver","dbeaver","Java",49312,4089,3249,3811,"Free universal database tool and SQL client",true,true,true
"nlohmann","json","C++",49256,7342,104,4650,"JSON for Modern C++",true,true,true
"AlistGo","alist","Go",49237,7967,559,1920,"🗂️A file list/WebDAV program that supports multiple storages, powered by Gin and Solidjs. / 一个支持多存储的文件列表/WebDAV程序，使用 Gin 和 Solidjs。",true,true,true
"huginn","huginn","Ruby",48986,4247,693,4766,"Create agents that monitor and act on your behalf.  Your agents are standing by!",true,true,true
"ghostty-org","ghostty","Zig",48942,2151,206,1459,"👻 Ghostty is a fast, feature-rich, and cross-platform terminal emulator that uses platform-native UI and GPU acceleration.",true,true,true
"TanStack","query","TypeScript",48942,3743,154,2390,"🤖 Powerful asynchronous state management, server-state utilities and data fetching for the web. TS/JS, React Query, Solid Query, Svelte Query and Vue Query.",true,false,true
"ComposioHQ","awesome-claude-skills","Python",48708,5018,413,162,"A curated list of awesome Claude Skills, resources, and tools for customizing Claude AI workflows",true,true,true
"iamkun","dayjs","JavaScript",48621,2425,1199,2909,"⏰ Day.js 2kB immutable date-time library alternative to Moment.js with the same modern API",true,true,true
"JuliaLang","julia","Julia",48536,5751,4731,5455,"The Julia Programming Language",true,false,true
"ReactiveX","RxJava","Java",48466,7602,19,4826,"RxJava – Reactive Extensions for the JVM – a library for composing asynchronous and event-based programs using observable sequences for the Java VM.",true,true,true
"algorithm-visualizer","algorithm-visualizer","JavaScript",48465,7582,78,3604,":fireworks:Interactive Online Platform that Visualizes Algorithms from Code",true,true,true
"expo","expo","TypeScript",48301,11557,904,3511,"An open-source framework for making universal native apps with React. Expo runs on Android, iOS, and the web.",true,false,true
"pandas-dev","pandas","Python",48261,19790,3570,5695,"Flexible and powerful data analysis / manipulation library for Python, providing labeled data structures similar to R data.frame objects, statistical functions, and much more",true,true,true
"freqtrade","freqtrade","Python",48112,10024,40,3236,"Free, open source crypto trading bot",true,false,true
"run-llama","llama_index","Python",48083,7109,255,1242,"LlamaIndex is the leading document agent and OCR platform",true,true,true
"ggml-org","whisper.cpp","C++",48054,5348,1160,1279,"Port of OpenAI's Whisper model in C/C++",true,true,true
"moment","moment","JavaScript",48032,7016,294,5506,"Parse, validate, manipulate, and display dates in javascript.",true,true,true
"serhii-londar","open-source-mac-os-apps","Unknown",48015,2497,47,3067,"🚀 Awesome list of open source applications for macOS. https://t.me/s/opensourcemacosapps",true,true,true
"hashicorp","terraform","Go",47998,10257,1892,4397,"Terraform enables you to safely and predictably create, change, and improve infrastructure. It is a source-available tool that codifies APIs into declarative configuration files that can be shared amongst team members, treated as code, edited, reviewed, and versioned.",true,false,true
"x64dbg","x64dbg","C++",47975,2693,587,4003,"An open-source user mode debugger for Windows. Optimized for reverse engineering and malware analysis.",true,true,true
"lllyasviel","Fooocus","Python",47920,7831,288,961,"Focus on prompting and generating",true,false,true
"type-challenges","type-challenges","TypeScript",47878,5236,33132,2073,"Collection of TypeScript type challenges with online judge",true,true,true
"kelseyhightower","kubernetes-the-hard-way","Unknown",47860,15589,47,3550,"Bootstrap Kubernetes the hard way. No scripts.",true,true,true
"skylot","jadx","Java",47828,5468,415,4757,"Dex to Java decompiler",true,false,true
"bigskysoftware","htmx","JavaScript",47720,1581,658,2174,"</> htmx - high power tools for HTML",true,false,true
"kamranahmedse","design-patterns-for-humans","Unknown",47656,5506,17,3326,"An ultra-simplified explanation to design patterns",true,true,true
"minimaxir","big-list-of-naughty-strings","Python",47619,2162,108,3884,"The Big List of Naughty Strings is a list of strings which have a high probability of causing issues when used as user-input data.",true,true,true
"gogs","gogs","Go",47603,5069,970,4427,"Gogs is a painless self-hosted Git service",true,false,true
"karan","Projects","Unknown",47543,10668,118,4650,":page_with_curl: A list of practical projects that anyone can solve in any programming language.",true,true,true
"OpenCut-app","OpenCut","TypeScript",47457,4949,281,279,"The open-source CapCut alternative",true,true,true
"akullpp","awesome-java","Unknown",47421,7654,24,4280,"A curated list of awesome frameworks, libraries and software for the Java programming language.",true,true,true
"crewAIInc","crewAI","Python",47411,6411,479,883,"Framework for orchestrating role-playing, autonomous AI agents. By fostering collaborative intelligence, CrewAI empowers agents to work together seamlessly, tackling complex tasks.",true,true,true
"1c7","chinese-independent-developer","Unknown",47406,4028,5,3110,"👩🏿‍💻👨🏾‍💻👩🏼‍💻👨🏽‍💻👩🏻‍💻中国独立开发者项目列表 -- 分享大家都在做什么",true,false,true
"tw93","Pake","Rust",47290,9353,0,1261,"🤱🏻 Turn any webpage into a desktop app with one command.",true,false,true
"Homebrew","brew","Ruby",47269,11046,22,3674,"🍺 The missing package manager for macOS (or Linux)",true,false,true
"brillout","awesome-react-components","Unknown",47156,3749,39,3563,"Curated List of React Components & Libraries.",true,true,true
"jakevdp","PythonDataScienceHandbook","Jupyter Notebook",47139,18802,230,3516,"Python Data Science Handbook: full text in Jupyter Notebooks",true,true,true
"makeplane","plane","TypeScript",47038,3821,698,1225,"🔥🔥🔥 Open-source Jira, Linear, Monday, and ClickUp alternative. Plane is a modern project management platform to manage tasks, sprints, docs, and triage.",true,false,true
"typescript-cheatsheets","react","JavaScript",47017,4293,1,2856,"Cheatsheets for experienced React developers getting started with TypeScript",true,false,true
"slab","quill","TypeScript",47000,3632,635,4988,"Quill is a modern WYSIWYG editor built for compatibility and extensibility",true,false,true
"GokuMohandas","Made-With-ML","Jupyter Notebook",46989,7377,24,2700,"Learn how to develop, deploy and iterate on production-grade ML applications.",true,true,true
"v2ray","v2ray-core","Go",46978,8869,8,3858,"A platform for building proxies to bypass network restrictions.",true,false,true
"serverless","serverless","JavaScript",46947,5736,1224,3994,"⚡ Serverless Framework – Effortlessly build apps that auto-scale, incur zero costs when idle, and require minimal maintenance using AWS Lambda and other managed cloud services.",true,false,true
"square","okhttp","Kotlin",46918,9281,91,4996,"Square’s meticulous HTTP client for the JVM, Android, and GraalVM.",true,false,true
"pixijs","pixijs","TypeScript",46826,4991,331,4813,"The HTML5 Creation Engine: Create beautiful digital content with the fastest, most flexible 2D WebGL renderer.",true,true,true
"NanmiCoder","MediaCrawler","Python",46798,10066,140,1023,"小红书笔记 | 评论爬虫、抖音视频 | 评论爬虫、快手视频 | 评论爬虫、B 站视频 ｜ 评论爬虫、微博帖子 ｜ 评论爬虫、百度贴吧帖子 ｜ 百度贴吧评论回复爬虫  | 知乎问答文章｜评论爬虫",true,true,true
"astral-sh","ruff","Rust",46736,1970,1929,1326,"An extremely fast Python linter and code formatter, written in Rust.",true,true,true
"discourse","discourse","Ruby",46649,8858,172,4823,"A platform for community discussion. Free, open, simple.",false,false,true
"metabase","metabase","Clojure",46617,6336,4030,4071,"The easy-to-use open source Business Intelligence and Embedded Analytics tool that lets everyone work with data :bar_chart:",true,true,true
"DovAmir","awesome-design-patterns","Unknown",46601,3217,22,2853,"A curated list of software and architecture related design patterns.",true,true,true
"ClickHouse","ClickHouse","C++",46585,8240,5550,3586,"ClickHouse® is a real-time analytics database management system",true,true,true
"oobabooga","text-generation-webui","Python",46369,5904,775,1193,"The original local LLM interface. Text, vision, tool-calling, training, and more. 100% offline.",true,true,true
"dypsilon","frontend-dev-bookmarks","Unknown",46292,5153,123,4662,"Manually curated collection of resources for frontend web developers.",true,true,true
"microsoft","AI-For-Beginners","Jupyter Notebook",46286,9469,4,1850,"12 Weeks, 24 Lessons, AI for All!",true,true,true
"Asabeneh","30-Days-Of-JavaScript","JavaScript",46204,10441,367,2286,"30 days of JavaScript programming challenge is a step-by-step guide to learn JavaScript programming language in 30 days. This challenge may take more than 100 days,  please just follow your own pace. These videos may help too: https://www.youtube.com/channel/UC7PNRuno1rzYPb1xLa4yktw",true,true,true
"ziishaned","learn-regex","Unknown",46152,6209,65,3171,"Learn regex the easy way",true,true,true
"acmesh-official","acme.sh","Shell",46121,5549,1370,3745,"A pure Unix shell script ACME client for SSL / TLS certificate automation",true,false,true
"tldraw","tldraw","TypeScript",46086,3105,325,1784,"very good whiteboard infinite canvas SDK",true,false,true
"microsoft","monaco-editor","JavaScript",45846,4017,828,3580,"A browser based code editor",true,false,true
"GitHubDaily","GitHubDaily","Unknown",45815,4589,555,2645,"坚持分享 GitHub 上高质量、有趣实用的开源技术教程、开发者工具、编程网站、技术资讯。A list cool, interesting projects of GitHub.",true,true,true
"coreybutler","nvm-windows","Go",45704,3777,82,4206,"A node.js version management utility for Windows. Ironically written in Go.",true,true,true
"android","architecture-samples","Kotlin",45623,11874,218,3704,"A collection of samples to discuss and showcase different architectural tools and patterns for Android apps.",true,true,true
"prisma","prisma","TypeScript",45611,2127,2541,2473,"Next-generation ORM for Node.js & TypeScript | PostgreSQL, MySQL, MariaDB, SQL Server, SQLite, MongoDB and CockroachDB",true,true,true
"jeecgboot","JeecgBoot","Java",45600,15855,81,2679,"一款 AI 驱动的低代码平台，提供""零代码""与""代码生成""双模式——零代码模式一句话搭建系统，代码生成模式自动输出前后端代码与建表 SQL，生成即可运行。平台内置 AI 聊天助手、AI大模型、知识库、AI流程编排、MCP 与插件体系，兼容主流大模型，支持一句话生成流程图、设计表单、聊天式业务操作，解决 Java 项目 80% 重复工作，高效且不失灵活。",true,true,true
"LeCoupa","awesome-cheatsheets","JavaScript",45566,6671,135,3061,"👩‍💻👨‍💻 Awesome cheatsheets for popular programming languages, frameworks and development tools. They include everything you should know in one single file.",true,true,true
"jestjs","jest","TypeScript",45330,6641,243,4491,"Delightful JavaScript Testing.",true,true,true
"bevyengine","bevy","Rust",45326,4477,3308,2260,"A refreshingly simple data-driven game engine built in Rust",true,true,true
"ColorlibHQ","AdminLTE","CSS",45321,18262,9,4476,"AdminLTE - Free admin dashboard template based on Bootstrap 5",true,true,true
"google","zx","JavaScript",45315,1229,36,1788,"A tool for writing better scripts",true,true,true
"gedoor","legado","Kotlin",45302,5128,69,2502,"Legado 3.0 Book Reader with powerful controls & full functions❤️阅读3.0, 阅读是一款可以自定义来源阅读网络内容的工具，为广大网络文学爱好者提供一种方便、快捷舒适的试读体验。",true,true,true
"slidevjs","slidev","TypeScript",45242,1985,193,1799,"Presentation Slides for Developers",true,false,true
"KRTirtho","spotube","Dart",45229,2024,766,1868,"🎧 Open source music streaming app! Available for both desktop & mobile!",true,true,true
"penpot","penpot","Clojure",45072,2632,578,3741,"Penpot: The open-source design tool for design and code collaboration",true,false,true
"RocketChat","Rocket.Chat","TypeScript",45035,13468,3639,3966,"The Secure CommsOS™ for mission-critical operations",true,true,true
"coqui-ai","TTS","Python",44924,6016,7,2137,"🐸💬 - a deep learning toolkit for Text-to-Speech, battle-tested in research and production",true,true,true
"isocpp","CppCoreGuidelines","CSS",44871,5546,250,3873,"The C++ Core Guidelines are a set of tried-and-true guidelines, rules, and best practices about coding in C++",true,true,true
"koala73","worldmonitor","TypeScript",44850,7232,79,78,"Real-time global intelligence dashboard. AI-powered news aggregation, geopolitical monitoring, and infrastructure tracking in a unified situational awareness interface",true,true,true
"apache","airflow","Python",44813,16778,1824,4001,"Apache Airflow - A platform to programmatically author, schedule, and monitor workflows",true,true,true
"meteor","meteor","JavaScript",44788,5266,375,5182,"Meteor, the JavaScript App Platform",true,true,true
"Leaflet","Leaflet","JavaScript",44732,6103,559,5665,"🍃 JavaScript library for mobile-friendly interactive maps 🇺🇦",true,true,false
"vercel","hyper","TypeScript",44716,3550,1024,3557,"A terminal built on web technologies",true,false,true
"666ghj","MiroFish","Python",44666,6232,217,122,"A Simple and Universal Swarm Intelligence Engine, Predicting Anything. 简洁通用的群体智能引擎，预测万物",true,true,true
"react-hook-form","react-hook-form","TypeScript",44635,2379,132,2579,"📋 React Hooks for form state management and validation (Web + React Native)",true,true,true
"docker","awesome-compose","HTML",44579,8093,355,2235,"Awesome Docker Compose samples",true,false,true
"grpc","grpc","C++",44561,11097,1216,4127,"C++ based gRPC (C++, Python, Ruby, Objective-C, PHP, C#)",true,true,false
"GitSquared","edex-ui","JavaScript",44530,3065,6,3346,"A cross-platform, customizable science fiction terminal emulator with advanced monitoring & touchscreen support.",true,false,true
"mudler","LocalAI","Go",44511,3812,153,1105,"LocalAI is the open-source AI engine. Run any model - LLMs, vision, voice, image, video - on any hardware. No GPU required.",true,true,true
"pyenv","pyenv","Shell",44507,3244,56,4957,"Simple Python version management",true,true,true
"tw93","Mole","Shell",44432,1304,0,186,"🐹 Deep clean and optimize your Mac.",true,false,true
"sudheerj","reactjs-interview-questions","JavaScript",44408,10303,11,2857,"List of top 500 ReactJS Interview Questions & Answers....Coding exercise questions are coming soon!!",true,true,true
"code-yeongyu","oh-my-openagent","TypeScript",44322,3298,347,115,"omo; the best agent harness - previously oh-my-opencode",true,false,true
"jingyaogong","minimind","Python",44303,5319,29,609,"🚀🚀 「大模型」2小时完全从0训练64M的小参数GPT！🌏 Train a 64M-parameter GPT from scratch in just 2h!",true,true,true
"lukasz-madon","awesome-remote-job","Unknown",44287,4509,45,4103,"A curated list of awesome remote jobs and resources. Inspired by https://github.com/vinta/awesome-python",true,true,true
"iina","iina","Swift",44232,2782,1972,3386,"The modern video player for macOS.",true,false,true
"upscayl","upscayl","TypeScript",44186,2139,60,1336,"🆙 Upscayl - #1 Free and Open Source AI Image Upscaler for Linux, MacOS and Windows.",true,false,true
"NaiboWang","EasySpider","JavaScript",44156,5386,266,2079,"A visual no-code/code-free web crawler/spider易采集：一个可视化浏览器自动化测试/数据采集/爬虫软件，可以无代码图形化的设计和执行爬虫任务。别名：ServiceWrapper面向Web应用的智能化服务封装系统。",true,true,true
"astaxie","build-web-application-with-golang","Go",44154,10525,138,4986,"A golang ebook intro how to build a web with golang",true,true,true
"streamlit","streamlit","Python",44054,4169,1311,2408,"Streamlit — A faster way to build and share data apps.",true,false,true
"parcel-bundler","parcel","JavaScript",44052,2277,593,3154,"The zero configuration build tool for the web. 📦🚀",true,true,true
"ruvnet","RuView","Rust",44030,5930,70,294,"π RuView: WiFi DensePose turns commodity WiFi signals into real-time human pose estimation, vital sign monitoring, and presence detection — all without a single pixel of video. ",true,true,true
"streamich","react-use","TypeScript",43968,3276,653,2709,"React Hooks — 👍",true,true,true
"SimplifyJobs","Summer2026-Internships","Python",43961,3166,4,2134,"Collection of Summer 2026 tech internships!",true,false,true
"yangshun","front-end-interview-handbook","MDX",43922,5951,11,2995,"Front End interview preparation materials for busy engineers (updated for 2026)",true,true,true
"babel","babel","TypeScript",43910,5817,762,4199,"🐠 Babel is a compiler for writing next generation JavaScript.",true,true,true
"square","retrofit","HTML",43907,7359,169,5681,"A type-safe HTTP client for Android and the JVM",true,false,true
"9001","copyparty","Python",43832,1790,253,2497,"Portable file server with accelerated resumable uploads, dedup, WebDAV, SFTP, FTP, TFTP, zeroconf, media indexer, thumbnails++ all in one file",true,false,true
"AykutSarac","jsoncrack.com","TypeScript",43799,3533,44,1517,"✨ Innovative and open-source visualization application that transforms various data formats, such as JSON, YAML, XML and CSV into interactive graphs.",true,true,true
"aymericdamien","TensorFlow-Examples","Jupyter Notebook",43790,14780,227,3789,"TensorFlow Tutorial and Examples for Beginners (support TF v1 & v2)",true,true,true
"gsd-build","get-shit-done","JavaScript",43744,3522,54,103,"A light-weight and powerful meta-prompting, context engineering and spec-driven development system for Claude Code by TÂCHES.",true,true,true
"helix-editor","helix","Rust",43650,3382,1460,2126,"A post-modern modal text editor.",true,true,true
"zhongyang219","TrafficMonitor","C++",43648,3620,1268,3163,"这是一个用于显示当前网速、CPU及内存利用率的桌面悬浮窗软件，并支持任务栏显示，支持更换皮肤。",true,true,true
"tmux","tmux","C",43648,2521,66,3950,"tmux source code",true,false,true
"spf13","cobra","Go",43527,3095,361,4588,"A Commander for modern Go CLI interactions",true,true,true
"milvus-io","milvus","Go",43483,3917,1096,2385,"Milvus is a high-performance, cloud-native vector database built for scalable vector ANN search",true,true,true
"getsentry","sentry","Python",43459,4642,2097,5688,"Developer-first error tracking and performance monitoring",true,true,true
"cli","cli","Go",43395,8173,948,2367,"GitHub’s official command line tool",true,true,true
"FuelLabs","fuels-rs","Rust",43336,1359,68,1608,"Fuel Network Rust SDK",true,false,true
"FuelLabs","fuels-ts","TypeScript",43292,1368,81,1666,"Fuel Network Typescript SDK",true,false,true
"TauricResearch","TradingAgents","Python",43143,7870,268,455,"TradingAgents: Multi-Agents LLM Financial Trading Framework",true,true,true
"exo-explore","exo","Python",43077,2974,170,641,"Run frontier AI locally.",true,true,true
"Kong","kong","Lua",43056,5102,136,4148,"🦍 The API and AI Gateway",true,false,true
"apache","spark","Scala",43049,29139,307,4414,"Apache Spark - A unified analytics engine for large-scale data processing",true,false,true
"DIYgod","RSSHub","TypeScript",43043,9497,356,2916,"🧡 Everything is RSSible",true,true,true
"Unitech","pm2","JavaScript",43015,2696,1097,4694,"Node.js Production Process Manager with a built-in Load Balancer.",true,false,true
"Light-City","CPlusPlusThings","C++",43012,8826,8,2449,"C++那些事",true,true,true
"alex","what-happens-when","Unknown",42945,5729,2070,4524,"An attempt to answer the age old interview question ""What happens when you type google.com into your browser and press enter?""",true,true,true
"jgm","pandoc","Haskell",42932,3795,1057,5851,"Universal markup converter",true,true,true
"Raphire","Win11Debloat","PowerShell",42868,1698,31,1977,"A simple, lightweight PowerShell script that allows you to remove pre-installed apps, disable telemetry, as well as perform various other changes to declutter and customize your Windows experience. Win11Debloat works for both Windows 10 and Windows 11.",true,false,true
"bannedbook","fanqiang","Kotlin",42854,7648,324,4091,"翻墙-科学上网",true,true,true
"mitmproxy","mitmproxy","Python",42841,4498,422,5884,"An interactive TLS-capable intercepting HTTP proxy for penetration testers and software developers.",true,false,true
"hiroi-sora","Umi-OCR","Python",42818,4228,329,1461,"OCR software, free and offline. 开源、免费的离线OCR软件。支持截屏/批量导入图片，PDF文档识别，排除水印/页眉页脚，扫描/生成二维码。内置多国语言库。",true,true,true
"ziglang","zig","Zig",42813,3078,3422,3887,"Moved to Codeberg",true,false,true
"faif","python-patterns","Python",42808,7044,13,5042,"A collection of design patterns/idioms in Python",true,true,true
"files-community","Files","C#",42722,2658,531,2639,"A modern file manager that helps users organize their files and folders.",true,true,true
"bmad-code-org","BMAD-METHOD","JavaScript",42656,5128,150,348,"Breakthrough Method for Agile Ai Driven Development",true,true,true
"VoltAgent","awesome-openclaw-skills","Unknown",42650,4061,10,62,"The awesome collection of OpenClaw skills. 5,400+ skills filtered and categorized from the official OpenClaw Skills Registry.🦞",true,true,true
"zhayujie","chatgpt-on-wechat","Python",42603,9863,352,1329,"CowAgent是基于大模型的超级AI助理，能主动思考和任务规划、访问操作系统和外部资源、创造和执行Skills、拥有长期记忆并不断成长，比OpenClaw更轻量和便捷。同时支持微信、飞书、钉钉、企微、QQ、公众号、网页等接入，可选择OpenAI/Claude/Gemini/DeepSeek/ Qwen/GLM/Kimi/LinkAI，能处理文本、语音、图片和文件，可快速搭建个人AI助理和企业数字员工。",true,true,true
"CherryHQ","cherry-studio","TypeScript",42492,3974,823,673,"AI productivity studio with smart chat, autonomous agents, and 300+ assistants. Unified access to frontier LLMs",true,true,true
"k88hudson","git-flight-rules","Unknown",42477,3187,16,4266,"Flight rules for git",true,true,true
"Aider-AI","aider","Python",42467,4085,1457,1053,"aider is AI pair programming in your terminal",true,true,true
"karanpratapsingh","system-design","Unknown",42467,5402,4,1320,"Learn how to design systems at scale and prepare for system design interviews",true,true,true
"Alamofire","Alamofire","Swift",42368,7656,44,4258,"Elegant HTTP Networking in Swift",true,true,true
"usebruno","bruno","JavaScript",42338,2247,1703,1277,"Opensource IDE For Exploring and Testing API's (lightweight alternative to Postman/Insomnia)",true,false,true
"fastapi","full-stack-fastapi-template","TypeScript",42312,8270,17,2589,"Full stack, modern web application template. Using FastAPI, React, SQLModel, PostgreSQL, Docker, GitHub Actions, automatic HTTPS and more.",true,true,true
"colinhacks","zod","TypeScript",42236,1873,300,2211,"TypeScript-first schema validation with static type inference",true,true,true
"twentyhq","twenty","TypeScript",42233,5607,110,1213,"Building a modern alternative to Salesforce, powered by the community.",true,true,true
"sharkdp","fd","Rust",42213,1020,177,3244,"A simple, fast and user-friendly alternative to 'find'",true,false,true
"gradio-app","gradio","Python",42189,3357,501,2656,"Build and share delightful machine learning apps, all in Python. 🌟 Star to support our work!",true,true,true
"siyuan-note","siyuan","TypeScript",42166,2624,342,2036,"A privacy-first, self-hosted, fully open source personal knowledge management software, written in typescript and golang.",true,false,true
"apachecn","ailearning","Python",42151,11591,3,3318,"AiLearning：数据分析+机器学习实战+线性代数+PyTorch+NLTK+TF2",true,true,true
"mingrammer","diagrams","Python",42133,2725,384,2245,":art: Diagram as Code for prototyping cloud system architectures",true,true,true
"deepspeedai","DeepSpeed","Python",41928,4766,1281,2255,"DeepSpeed is a deep learning optimization library that makes distributed training and inference easy, efficient, and effective.",true,true,true
"byoungd","English-level-up-tips","Unknown",41864,4407,28,3224,"An advanced guide to learn English which might benefit you a lot 🎉 .  离谱的英语学习指南/英语学习教程/英语学习/学英语",true,true,true
"ray-project","ray","Python",41863,7392,3532,3440,"Ray is an AI compute engine. Ray consists of a core distributed runtime and a set of AI Libraries for accelerating ML workloads.",true,true,true
"nolimits4web","swiper","JavaScript",41827,9704,247,5126,"Most modern mobile touch slider with hardware accelerated transitions",true,true,true
"thedotmack","claude-mem","TypeScript",41811,3108,215,208,"A Claude Code plugin that automatically captures everything Claude does during your coding sessions, compresses it with AI (using Claude's agent-sdk), and injects relevant context back into future sessions.",true,true,true
