organization,repo_name,language,stars,forks,open_issues,age_days,description,has_coc,has_contributing,has_workflows
"juspay","hyperswitch","Rust",41771,4578,1441,1258,"An open source payments switch written in Rust to make payments fast, reliable and affordable",true,true,true
"logseq","logseq","Clojure",41730,2522,1008,2135,"A privacy-first, open-source platform for knowledge management and collaboration. Download link:  http://github.com/logseq/logseq/releases. roadmap: https://discuss.logseq.com/t/logseq-product-roadmap/34267",true,true,true
"apache","dubbo","Java",41709,26523,948,5030,"The java implementation of Apache Dubbo. An RPC and microservice framework.",true,true,true
"nwjs","nw.js","JavaScript",41570,3870,959,5197,"Call all Node.js modules directly from DOM/WebWorker and enable a new way of writing applications with all Web technologies.",true,true,true
"ccxt","ccxt","Python",41551,8564,1383,3239,"A cryptocurrency trading API with more than 100 exchanges in JavaScript / TypeScript / Python / C# / PHP / Go ",true,true,true
"yarnpkg","yarn","JavaScript",41530,2732,2062,3720,"The 1.x line is frozen - features and bugfixes now happen on https://github.com/yarnpkg/berry",true,true,true
"payloadcms","payload","TypeScript",41479,3518,798,1907,"Payload is the open-source, fullstack Next.js framework, giving you instant backend superpowers. Get a full TypeScript backend and admin panel instantly. Use Payload as a headless CMS or for building powerful applications.",true,true,true
"shareAI-lab","learn-claude-code","TypeScript",41467,6433,84,271,"Bash is all you need -  A nano claude code–like 「agent harness」, built from 0 to 1",true,true,true
"dcloudio","uni-app","Objective-C",41460,3715,675,2816,"A cross-platform framework using Vue.js",true,true,true
"dylanaraps","pure-bash-bible","Shell",41444,3639,62,2845,"📖 A collection of pure bash alternatives to external processes.",true,false,true
"psf","black","Python",41437,2742,327,2935,"The uncompromising Python code formatter",true,true,true
"hpcaitech","ColossalAI","Python",41377,4523,492,1611,"Making large AI models cheaper, faster and more accessible",true,true,true
"hexojs","hexo","TypeScript",41334,5035,97,4933,"A fast, simple & powerful blog framework, powered by Node.js.",true,false,true
"janhq","jan","TypeScript",41316,2636,284,954,"Jan is an open source alternative to ChatGPT that runs 100% offline on your computer.",true,true,true
"BerriAI","litellm","Python",41304,6812,2109,975,"Python SDK, Proxy Server (AI Gateway) to call 100+ LLM APIs in OpenAI (or native) format, with cost tracking, guardrails, loadbalancing and logging. [Bedrock, Azure, OpenAI, VertexAI, Cohere, Anthropic, Sagemaker, HuggingFace, VLLM, NVIDIA NIM]",true,true,true
"fastlane","fastlane","Ruby",41278,5981,824,4133,"🚀 The easiest way to automate building and releasing your iOS and Android apps",true,true,true
"zai-org","ChatGLM-6B","Python",41209,5200,605,1111,"ChatGLM-6B: An Open Bilingual Dialogue Language Model | 开源双语对话语言模型",true,true,true
"chubin","cheat.sh","Python",41158,1901,144,3246,"the only cheat sheet you need",true,true,true
"curl","curl","C",41149,7110,45,5853,"A command line tool and library for transferring data with URL syntax, supporting DICT, FILE, FTP, FTPS, GOPHER, GOPHERS, HTTP, HTTPS, IMAP, IMAPS, LDAP, LDAPS, MQTT, MQTTS, POP3, POP3S, RTMP, RTMPS, RTSP, SCP, SFTP, SMB, SMBS, SMTP, SMTPS, TELNET, TFTP, WS and WSS. libcurl offers a myriad of powerful features",true,false,false
"bailicangdu","vue2-elm","Vue",41140,12321,121,3382,"Large single page application with 45 pages built on vue2 + vuex. 基于 vue2 + vuex 构建一个具有 45 个页面的大型单页面应用",true,true,true
"remotion-dev","remotion","TypeScript",41033,2623,70,2103,"🎥      Make videos programmatically with React",true,true,true
"styled-components","styled-components","TypeScript",41027,2527,9,3511,"Fast, expressive styling for React. Server components, client components, streaming SSR, React Native—one API.",true,false,true
"charmbracelet","bubbletea","Go",41010,1147,173,2268,"A powerful little TUI framework 🏗",true,true,true
"zen-browser","desktop","JavaScript",41006,1407,515,730,"Welcome to a calmer internet",true,true,true
"vuetifyjs","vuetify","TypeScript",40992,7159,633,3484,"🐉 Vue Component Framework",true,false,true
"tabler","tabler","HTML",40884,4352,110,2977,"Tabler is free and open-source HTML Dashboard UI Kit built on Bootstrap",true,true,true
"calcom","cal.com","TypeScript",40740,12330,1366,1832,"Scheduling infrastructure for absolutely everyone.",true,false,true
"DataExpert-io","data-engineer-handbook","Jupyter Notebook",40738,7760,25,859,"This is a repo with links to everything you'd ever want to learn about data engineering",true,true,true
"LC044","WeChatMsg","Unknown",40709,4923,25,1172,"",false,true,true
"zbezj","HEU_KMS_Activator","Unknown",40647,3832,168,2470,"",true,true,true
"saadeghi","daisyui","Svelte",40619,1628,56,1945,"🌼 🌼 🌼 🌼 🌼  The most popular, free and open-source Tailwind CSS component library",true,false,true
"bradtraversy","50projects50days","CSS",40485,9771,48,1957,"50+ mini web projects using HTML, CSS & JS",false,true,true
"aria2","aria2","C++",40427,3836,1140,5600,"aria2 is a lightweight multi-protocol & multi-source, cross platform download utility operated in command-line. It supports HTTP/HTTPS, FTP, SFTP, BitTorrent and Metalink.",true,true,true
"QSCTech","zju-icicles","HTML",40380,9599,10,3559,"浙江大学课程攻略共享计划",true,true,true
"chakra-ui","chakra-ui","TypeScript",40333,3574,18,2414,"Chakra UI is a component system for building SaaS products with speed ⚡️",true,false,true
"danielmiessler","Fabric","Go",40210,4008,26,814,"Fabric is an open-source framework for augmenting humans using AI. It provides a modular system for solving specific problems using a crowdsourced set of AI prompts that can be used anywhere.",true,true,true
"wg","wrk","C",40164,3029,203,5121,"Modern HTTP benchmarking tool",true,true,true
"remoteintech","remote-jobs","Nunjucks",40128,3930,19,3819,"Source for remoteintech.company — a community-maintained directory of remote-friendly tech companies",true,false,true
"HeyPuter","puter","JavaScript",40086,3576,190,755,"🌐 The Internet Computer! Free, Open-Source, and Self-Hostable.",true,true,true
"vim","vim","Vim Script",40078,6022,1660,3874,"The official Vim repository",true,true,false
"666ghj","BettaFish","Python",39973,7424,58,635,"微舆：人人可用的多Agent舆情分析助手，打破信息茧房，还原舆情原貌，预测未来走向，辅助决策！从0实现，不依赖任何框架。",true,true,true
"php","php-src","C",39967,8022,1755,5399,"The PHP Interpreter",true,false,true
"google-research","bert","Python",39944,9708,881,2710,"TensorFlow code and pre-trained models for BERT",true,false,true
"pingcap","tidb","Go",39905,6159,5895,3856,"TiDB - the open-source, cloud-native, distributed SQL database designed for modern applications.",true,true,true
"freefq","free","Unknown",39838,5651,561,2120,"翻墙、免费翻墙、免费科学上网、免费节点、免费梯子、免费ss/v2ray/trojan节点、蓝灯、谷歌商店、翻墙梯子",true,true,true
"trpc","trpc","TypeScript",39836,1525,189,2079,"🧙‍♀️  Move Fast and Break Nothing. End-to-end typesafe APIs made easy. ",true,false,true
"evanw","esbuild","Go",39813,1300,606,3573,"An extremely fast bundler for the web",true,false,true
"go-gorm","gorm","Go",39632,4144,519,4537,"The fantastic ORM library for Golang, aims to be developer friendly",true,true,true
"videojs","video.js","JavaScript",39623,7510,636,5796,"Video.js - open source HTML5 video player",true,true,false
"facebookresearch","faiss","C++",39535,4311,302,3335,"A library for efficient similarity search and clustering of dense vectors.",true,true,true
"gofiber","fiber","Go",39486,1968,45,2263,"⚡️ Express inspired web framework written in Go",true,true,true
"floodsung","Deep-Learning-Papers-Reading-Roadmap","Python",39481,7314,92,3452,"Deep Learning papers reading roadmap for anyone who are eager to learn this amazing tech!",true,true,true
"photoprism","photoprism","Go",39477,2235,446,2982,"AI-Powered Photos App for the Decentralized Web 🌈💎✨",true,true,true
"appsmithorg","appsmith","TypeScript",39459,4508,4458,2097,"Platform to build admin panels, internal tools, and dashboards. Integrates with 25+ databases and any API.",true,true,true
"lm-sys","FastChat","Python",39455,4786,1003,1105,"An open platform for training, serving, and evaluating large language models. Release repo for Vicuna and Chatbot Arena.",true,false,true
"microsoft","qlib","Python",39429,6158,385,2052,"Qlib is an AI-oriented Quant investment platform that aims to use AI tech to empower Quant Research, from exploring ideas to implementing productions. Qlib supports diverse ML modeling paradigms, including supervised learning, market dynamics modeling, and RL, and is now equipped with https://github.com/microsoft/RD-Agent to automate R&D process.",true,true,true
"mifi","lossless-cut","TypeScript",39380,1915,246,3436,"The swiss army knife of lossless video/audio editing",true,true,true
"goabstract","Awesome-Design-Tools","JavaScript",39380,2211,132,2601,"The best design tools and plugins for everything 👉",true,true,true
"DataTalksClub","data-engineering-zoomcamp","Jupyter Notebook",39369,7912,6,1619,"Data Engineering Zoomcamp is a free 9-week course on building production-ready data pipelines. The next cohort starts in January 2026. Join the course here 👇🏼",true,true,true
"imputnet","cobalt","Svelte",39302,3290,231,1358,"best way to save what you love",true,true,true
"phaserjs","phaser","JavaScript",39249,7124,121,4733,"Phaser is a fun, free and fast 2D game framework for making HTML5 games for desktop and mobile web browsers, supporting Canvas and WebGL rendering.",true,false,true
"koalaman","shellcheck","Haskell",39185,1907,1208,4879,"ShellCheck, a static analysis tool for shell scripts",true,true,true
"chatboxai","chatbox","TypeScript",39166,3963,1085,1118,"Powerful AI Client",true,false,true
"google","styleguide","HTML",39148,12999,173,3964,"Style guides for Google-originated open-source projects",true,false,false
"Dogfalo","materialize","JavaScript",39105,4656,791,4214,"Materialize, a CSS Framework based on Material Design",true,true,true
"QuivrHQ","quivr","Python",39075,3741,23,1050,"Opiniated RAG for integrating GenAI in your apps 🧠   Focus on your product rather than the RAG. Easy integration in existing products with customisation!  Any LLM: GPT4, Groq, Llama. Any Vectorstore: PGVector, Faiss. Any Files. Anyway you want.",true,true,true
"suno-ai","bark","Jupyter Notebook",39062,4683,267,1085,"🔊 Text-Prompted Generative Audio Model",true,true,true
"2noise","ChatTTS","Python",39000,4232,66,669,"A generative speech model for daily dialogue.",true,true,true
"agno-agi","agno","Python",38992,5168,679,1423,"Build, run, manage agentic software at scale.",true,true,true
"google","leveldb","C++",38928,8174,378,4230,"LevelDB is a fast key-value storage library written at Google that provides an ordered mapping from string keys to string values.",true,false,false
"mindsdb","mindsdb","Python",38855,6166,109,2794,"Query Engine for AI Analytics: Build self-reasoning agents across all your live data",true,true,true
"nushell","nushell","Rust",38845,2085,1478,2513,"A new type of shell",true,true,true
"novuhq","novu","TypeScript",38745,4249,146,1674,"The open-source notification Inbox infrastructure. E-mail, SMS, Push and Slack Integrations.",true,false,true
"PatrickJS","awesome-cursorrules","MDX",38738,3281,94,557,"📄  Configuration files that enhance Cursor AI editor experience with custom rules and behaviors",true,true,true
"freeCodeCamp","devdocs","Ruby",38644,2579,225,4537,"API Documentation Browser",true,false,true
"preactjs","preact","JavaScript",38517,2028,148,3851,"⚛️ Fast 3kB React alternative with the same modern API. Components & Virtual DOM.",true,true,true
"impress","impress.js","JavaScript",38513,6617,60,5203,"It's a presentation framework based on the power of CSS3 transforms and transitions in modern browsers and inspired by the idea behind prezi.com.",true,true,true
"vnpy","vnpy","Python",38498,11232,13,4044,"基于Python的开源量化交易平台开发框架",true,true,true
"google","googletest","C++",38408,10728,528,3895,"GoogleTest - Google Testing and Mocking Framework",true,false,false
"gto76","python-cheatsheet","Python",38310,6732,0,2984,"Comprehensive Python Cheatsheet",true,true,true
"PhilJay","MPAndroidChart","Java",38229,9047,2190,4354,"A powerful 🚀 Android chart view / graph view library, supporting line- bar- pie- radar- bubble- and candlestick charts as well as scaling, panning and animations.",true,true,true
"Kong","insomnia","TypeScript",38226,2257,819,3626,"The open-source, cross-platform API client for GraphQL, REST, WebSockets, SSE and gRPC. With Cloud, Local and Git storage.",true,false,true
"lapce","lapce","Rust",38194,1242,872,2972,"Lightning-fast and Powerful Code Editor written in Rust",true,true,true
"halo-dev","halo","Java",38157,10228,244,2929,"强大易用的开源建站工具。",true,true,true
"istio","istio","Go",38074,8278,530,3416,"Connect, secure, control, and observe services.",true,false,true
"ant-design","ant-design-pro","TypeScript",38036,8233,179,3137,"👨🏻‍💻👩🏻‍💻 Use Ant Design like a Pro!",true,true,true
"naptha","tesseract.js","JavaScript",37962,2364,42,3930,"Pure Javascript OCR for more than 100 Languages 📖🎉🖥",true,true,true
"pola-rs","polars","Rust",37889,2708,2729,2144,"Extremely fast Query Engine for DataFrames, written in Rust",true,true,true
"RSSNext","Folo","TypeScript",37848,2007,387,719,"🧡 Folo is the AI RSS Reader",true,true,true
"outline","outline","TypeScript",37843,3161,69,3596,"The fastest knowledge base for growing teams. Beautiful, realtime collaborative, feature packed, and markdown compatible.",true,false,true
"CorentinTh","it-tools","Vue",37839,4709,761,2183,"Collection of handy online tools for developers, with great UX. ",true,true,true
"dotnet","aspnetcore","C#",37797,10622,3848,4400,"ASP.NET Core is a cross-platform .NET framework for building modern cloud-based web applications on Windows, Mac, or Linux.",true,true,true
"rapid7","metasploit-framework","Ruby",37791,14804,589,5324,"Metasploit Framework",true,true,true
"denysdovhan","wtfjs","JavaScript",37783,2691,44,3178,"🤪 A list of funny and tricky JavaScript examples",true,false,true
"httpie","cli","Python",37777,3842,259,5145,"🥧 HTTPie CLI  — modern, user-friendly command-line HTTP client for the API era. JSON support, colors, sessions, downloads, plugins & more.",true,false,true
"paperless-ngx","paperless-ngx","Python",37691,2395,14,1504,"A community-supported supercharged document management system: scan, index and archive all your documents",true,false,true
"TeamNewPipe","NewPipe","Java",37677,3526,1390,3858,"A libre lightweight streaming front-end for Android.",true,true,true
"chatchat-space","Langchain-Chatchat","Python",37664,6186,16,1093,"Langchain-Chatchat（原Langchain-ChatGLM）基于 Langchain 与 ChatGLM, Qwen 与 Llama 等语言模型的 RAG 与 Agent 应用 | Langchain-Chatchat (formerly langchain-ChatGLM), local knowledge based LLM (like ChatGLM, Qwen and Llama) RAG and Agent app with langchain ",true,true,true
"ToolJet","ToolJet","JavaScript",37663,4977,966,1824,"ToolJet is the open-source foundation of ToolJet AI - the AI-native platform for building internal tools, dashboard, business applications, workflows and AI agents 🚀",true,true,true
"huihut","interview","C++",37660,8123,2,2969,"📚 C/C++ 技术面试基础知识总结，包括语言、程序库、数据结构、算法、系统、网络、链接装载库等知识及面试经验、招聘、内推等信息。This repository is a summary of the basic knowledge of recruiting job seekers and beginners in the direction of C/C++ technology, including language, program library, data structure, algorithm, system, network, link loading library, interview experience, recruitment, recommendation, etc.",true,true,true
"kilimchoi","engineering-blogs","Ruby",37647,1976,145,3940,"A curated list of engineering blogs",true,true,true
"llvm","llvm-project","LLVM",37627,16692,35134,3398,"The LLVM Project is a collection of modular and reusable compiler and toolchain technologies.",true,false,true
"FreeCodeCampChina","freecodecamp.cn","CSS",37625,1412,157,3466,"FCC China open source codebase and curriculum. Learn to code and help nonprofits.",true,true,true
"google-research","google-research","Jupyter Notebook",37566,8368,1819,2731,"Google Research",true,false,true
"spacedriveapp","spacedrive","Rust",37509,1238,25,1643,"Spacedrive is an open source cross-platform file explorer, powered by a virtual distributed filesystem written in Rust.",true,false,true
"vlang","v","V",37458,2239,990,2605,"Simple, fast, safe, compiled language for developing maintainable software. Compiles itself in <1s with zero library dependencies. Supports automatic C => V translation. https://vlang.io",true,true,true
"ManimCommunity","manim","Python",37436,2747,467,2139,"A community-maintained Python framework for creating mathematical animations. ",true,true,true
"LAION-AI","Open-Assistant","Python",37425,3305,296,1201,"OpenAssistant is a chat-based assistant that understands tasks, can interact with third-party systems, and retrieve information dynamically to do so.",true,true,true
"exelban","stats","Swift",37419,1231,32,2494,"macOS system monitor in your menu bar",true,true,true
"TencentARC","GFPGAN","Python",37407,6281,403,1835,"GFPGAN aims at developing Practical Algorithms for Real-world Face Restoration.",true,true,true
"NervJS","taro","TypeScript",37373,4898,1719,2911,"开放式跨端跨框架解决方案，支持使用 React/Vue 等框架来开发微信/京东/百度/支付宝/字节跳动/ QQ 小程序/H5/React Native 等应用。  https://taro.zone/",true,true,true
"gkd-kit","gkd","Kotlin",37353,1798,11,998,"基于无障碍，高级选择器，订阅规则的自定义屏幕点击安卓应用 | An Android APP with custom screen tapping based on Accessibility, Advanced Selectors, and Subscription Rules",true,false,true
"eugenp","tutorials","Java",37347,53713,29,4715,"Getting Started with Spring Boot 3: ",true,true,true
"huiyadanli","RevokeMsgPatcher","C#",37265,3953,55,2441,":trollface: A hex editor for WeChat/QQ/TIM - PC版微信/QQ/TIM防撤回补丁（我已经看到了，撤回也没用了）",true,true,true
"exacity","deeplearningbook-chinese","TeX",37225,9162,67,3398,"Deep Learning Book Chinese Translation",true,true,true
"DavidHDev","react-bits","JavaScript",37223,1649,6,599,"An open source collection of animated, interactive & fully customizable React components for building memorable websites.",true,false,true
"0voice","interview_internal_reference","Python",37220,9412,36,2483,"2025年最新总结，阿里，腾讯，百度，美团，头条等技术面试题目，以及答案，专家出题人分析汇总。",true,true,true
"alibaba","arthas","Java",37215,7635,471,2767,"Alibaba Java Diagnostic Tool Arthas/Alibaba Java诊断利器Arthas",true,true,true
"docker","compose","Go",37191,5763,86,4492,"Define and run multi-container applications with Docker",true,false,true
"openai","gym","Python",37117,8707,128,3621,"A toolkit for developing and comparing reinforcement learning algorithms.",true,true,true
"duckdb","duckdb","C++",37028,3042,632,2831,"DuckDB is an analytical in-process SQL database management system",true,true,true
"drawdb-io","drawdb","JavaScript",36999,2967,214,985,"Free, simple, and intuitive online database diagram editor and SQL generator.",true,true,true
"portainer","portainer","TypeScript",36980,2802,729,3599,"Making Docker and Kubernetes management easy.",true,true,true
"chatanywhere","GPT_API_free","Python",36951,2582,64,1070,"Free ChatGPT&DeepSeek API Key，免费ChatGPT&DeepSeek API。免费接入DeepSeek API和GPT4 API，支持 gpt | deepseek | claude | gemini | grok 等排名靠前的常用大模型。",true,true,true
"sqlmapproject","sqlmap","Python",36947,6234,59,5023,"Automatic SQL injection and database takeover tool",true,true,true
"AobingJava","JavaFamily","Unknown",36929,7802,6,2328,"【Java面试+Java学习指南】 一份涵盖大部分Java程序员所需要掌握的核心知识。",true,true,true
"satwikkansal","wtfpython","Python",36910,2664,70,3133,"What the f*ck Python? 😱",true,true,true
"juanfont","headscale","Go",36894,1987,128,2106,"An open source, self-hosted implementation of the Tailscale control server",true,true,true
"babysor","MockingBird","Python",36893,5233,482,1694,"🚀Clone a voice in 5 seconds to generate arbitrary speech in real-time",true,true,true
"PKUanonym","REKCARC-TSC-UHT","HTML",36879,7847,2,2549,"清华大学计算机系课程攻略 Guidance for courses in Department of Computer Science and Technology, Tsinghua University",true,true,true
"inkonchain","docs","MDX",36793,457,49,689,"Ink Documentation",true,false,false
"microsoft","BitNet","Python",36793,3203,290,600,"Official inference framework for 1-bit LLMs",true,true,true
"roboflow","supervision","Python",36787,3157,133,1215,"We write your reusable computer vision tools. 💜",true,true,true
"alebcay","awesome-shell","Unknown",36765,2489,146,4282,"A curated list of awesome command-line frameworks, toolkits, guides and gizmos. Inspired by awesome-php.",true,true,true
"markedjs","marked","JavaScript",36750,3515,15,5361,"A markdown parser and compiler. Built for speed.",true,true,true
"shadowsocks","shadowsocks-android","Kotlin",36740,11519,60,4850,"A shadowsocks client for Android",true,true,true
"inkonchain","node","Shell",36739,633,18,683,"How to run an Ink Node",true,false,false
"HKUDS","nanobot","Python",36703,6307,869,55,"""🐈 nanobot: The Ultra-Lightweight OpenClaw""",true,true,true
"inkonchain","ink-kit","TypeScript",36647,427,3,508,"React component library for onchain applications - See README for modern alternatives",true,false,false
"karpathy","LLM101n","Unknown",36620,2002,19,670,"LLM101n: Let's build a Storyteller",false,false,true
"open-guides","og-aws","Shell",36591,3908,160,3544,"📙 Amazon Web Services — a practical guide",true,true,true
"fengdu78","Coursera-ML-AndrewNg-Notes","HTML",36572,11157,67,3066,"吴恩达老师的机器学习课程个人笔记",true,true,true
"huggingface","pytorch-image-models","Python",36559,5142,63,2611,"The largest collection of PyTorch image encoders / backbones. Including train, eval, inference, export scripts, and pretrained weights -- ResNet, ResNeXT, EfficientNet, NFNet, Vision Transformer (ViT), MobileNetV4, MobileNet-V3 & V2, RegNet, DPN, CSPNet, Swin Transformer, MaxViT, CoAtNet, ConvNeXt, and more",true,true,true
"date-fns","date-fns","TypeScript",36536,1942,916,4191,"⏳ Modern JavaScript date utility library ⌛️",true,false,true
"anthropics","claude-cookbooks","Jupyter Notebook",36478,3958,81,955,"A collection of notebooks/recipes showcasing some fun and effective ways of using Claude.",true,true,true
"typeorm","typeorm","TypeScript",36408,6505,515,3680,"TypeScript & JavaScript ORM for Node.js — supports PostgreSQL, MySQL, MariaDB, SQLite, SQL Server, Oracle, and more.",true,false,true
"XTLS","Xray-core","Go",36309,5101,34,1965,"Xray, Penetrates Everything. Also the best v2ray-core. Where the magic happens. An open platform for various uses.",true,true,true
"aseprite","aseprite","C++",36277,7900,1907,4238,"Animated sprite editor & pixel art tool (Windows, macOS, Linux)",true,true,true
"hankcs","HanLP","Python",36225,10906,12,4188,"中文分词 词性标注 命名实体识别 依存句法分析 成分句法分析 语义依存分析 语义角色标注 指代消解 风格转换 语义相似度 新词发现 关键词短语提取 自动摘要 文本分类聚类 拼音简繁转换 自然语言处理",true,true,true
"SheetJS","sheetjs","Unknown",36223,7958,132,4862,"📗 SheetJS Spreadsheet Data Toolkit -- New home https://git.sheetjs.com/SheetJS/sheetjs",true,false,true
"paperclipai","paperclip","TypeScript",36201,5232,1144,25,"Open-source orchestration for zero-human companies",true,true,true
"qbittorrent","qBittorrent","C++",36199,4600,2527,5166,"qBittorrent BitTorrent client",true,true,true
"formulahendry","955.WLB","Unknown",36173,1750,202,2557,"955 不加班的公司名单 - 工作 955，work–life balance (工作与生活的平衡)",true,true,true
"myshell-ai","OpenVoice","Python",36165,4041,300,850,"Instant voice cloning by MIT and MyShell. Audio foundation model.",true,true,true
"slatedocs","slate","Unknown",36156,355,50,4578,"Beautiful static documentation for your API",true,false,true
"servo","servo","Rust",36143,3557,3140,5161,"Servo aims to empower developers with a lightweight, high-performance alternative for embedding web technologies in applications.",true,true,true
"lerna","lerna","TypeScript",36088,2279,310,3767,"Lerna is a fast, modern build system for managing and publishing multiple JavaScript/TypeScript packages from the same repository.",true,false,true
"deepseek-ai","awesome-deepseek-integration","Unknown",36073,4006,26,807,"Integrate the DeepSeek API into popular software",true,true,true
"YunaiV","ruoyi-vue-pro","Java",36067,7781,6,1889,"🔥 官方推荐 🔥 RuoYi-Vue 全新 Pro 版本，优化重构所有功能。基于 Spring Boot + MyBatis Plus + Vue & Element 实现的后台管理系统 + 微信小程序，支持 RBAC 动态权限、数据权限、SaaS 多租户、Flowable 工作流、三方登录、支付、短信、商城、CRM、ERP、AI 大模型、IoT 物联网等功能。你的 ⭐️ Star ⭐️，是作者生发的动力！",true,true,true
