organization,repo_name,language,stars,forks,open_issues,age_days,description,has_coc,has_contributing,has_workflows,homepage,topics,license,last_updated
"codecrafters-io","build-your-own-x","Markdown",520275,49210,515,2971,"Master programming by recreating your favorite technologies from scratch.",true,false,true,"https://codecrafters.io","awesome-list|free|programming|tutorial-code|tutorial-exercises|tutorials","No License",2
"sindresorhus","awesome","Unknown",479360,35585,87,4369,"😎 Awesome lists about all kinds of interesting topics",true,false,true,"","awesome|awesome-list|lists|resources|unicorns","Creative Commons Zero v1.0 Universal",2
"freeCodeCamp","freeCodeCamp","TypeScript",450634,45263,196,4203,"freeCodeCamp.org's open-source codebase and curriculum. Learn math, programming, and computer science for free.",true,true,true,"https://contribute.freecodecamp.org","careers|certification|community|curriculum|d3|education|freecodecamp|javascript|learn-to-code|math|nodejs|nonprofits|programming|react|teachers","BSD 3-Clause ""New"" or ""Revised"" License",0
"public-apis","public-apis","Python",444578,48762,1469,3751,"A collective list of free APIs",true,false,true,"https://APILayer.com/?utm_source=Github&utm_medium=Referral&utm_campaign=Public-apis-repo","api|apis|dataset|development|free|list|lists|open-source|public|public-api|public-apis|resources|software","MIT License",0
"EbookFoundation","free-programming-books","Python",390884,66450,81,4642,":books: Freely available programming books",true,false,true,"https://ebookfoundation.github.io/free-programming-books/","books|education|hacktoberfest|list|resource","Creative Commons Attribution 4.0 International",3
"openclaw","openclaw","TypeScript",380745,79772,6739,215,"Your own personal AI assistant. Any OS. Any Platform. The lobster way. 🦞 ",true,false,true,"https://openclaw.ai","ai|assistant|crustacean|molty|openclaw|own-your-data|personal","Other",0
"nilbuild","developer-roadmap","TypeScript",358476,44292,19,3391,"Interactive roadmaps, guides and other educational content to help developers grow in their careers.",true,false,true,"https://roadmap.sh","angular-roadmap|backend-roadmap|blockchain-roadmap|computer-science|dba-roadmap|developer-roadmap|devops-roadmap|frontend-roadmap|go-roadmap|java-roadmap|javascript-roadmap|nodejs-roadmap|python-roadmap|qa-roadmap|react-roadmap|roadmap|software-architect-roadmap|vue-roadmap","Other",2
"donnemartin","system-design-primer","Python",355171,56937,559,3408,"Learn how to design large-scale systems. Prep for the system design interview.  Includes Anki flashcards.",true,true,true,"","design|design-patterns|design-system|development|interview|interview-practice|interview-questions|programming|python|system|web|web-application|webapp","Other",99
"jwasham","coding-interview-university","Unknown",354257,83929,118,3673,"A complete computer science study plan to become a software engineer.",true,false,true,"","algorithm|algorithms|coding-interview|coding-interviews|computer-science|data-structures|interview|interview-prep|interview-preparation|programming-interviews|software-engineering|study-plan","Creative Commons Attribution Share Alike 4.0 International",303
"vinta","awesome-python","Python",305131,28161,23,4383,"An opinionated list of Python frameworks, libraries, tools, and resources",false,false,true,"https://awesome-python.com/","awesome|collections|python|python-frameworks|python-libraries|python-tools","Other",1
"awesome-selfhosted","awesome-selfhosted","Unknown",301489,14041,0,4044,"A list of Free Software network services and web applications which can be hosted on your own servers",false,false,true,"https://awesome-selfhosted.net/","awesome|awesome-list|cloud|free-software|hosting|privacy|self-hosted|selfhosted","Other",0
"996icu","996.ICU","Unknown",276330,20814,16692,2650,"Repo for counting stars and contributing. Press F to pay respect to glorious developers.",false,false,true,"https://996.icu","","Other",309
"practical-tutorials","project-based-learning","Unknown",271126,35037,317,3363,"Curated list of project-based tutorials",true,true,true,"","beginner-project|cpp|golang|javascript|project|python|tutorial|webdevelopment","MIT License",681
"react","react","JavaScript",246158,51090,1269,4782,"The library for web and native user interfaces.",true,false,true,"https://react.dev","declarative|frontend|javascript|library|react|ui","MIT License",1
"obra","superpowers","Shell",240057,21302,286,261,"An agentic skills framework & software development methodology that works.",true,true,true,"","ai|brainstorming|coding|obra|sdlc|skills|subagent-driven-development|superpowers","MIT License",2
"torvalds","linux","C",237730,62905,3,5410,"Linux kernel source tree",false,true,true,"","","Other",0
"trimstray","the-book-of-secret-knowledge","Unknown",230532,13781,158,2926,"A collection of inspiring lists, manuals, cheatsheets, blogs, hacks, one-liners, cli/web tools and more.",false,false,true,"","awesome|awesome-list|bsd|cheatsheets|devops|guidelines|hacking|hacks|howtos|linux|lists|manuals|one-liners|pentesters|resources|search-engines|security|security-researchers|sysops","MIT License",585
"affaan-m","ECC","JavaScript",222644,34086,97,161,"The agent harness performance optimization system. Skills, instincts, memory, security, and research-first development for Claude Code, Codex, Opencode, Cursor and beyond.",true,true,true,"https://ecc.tools","ai-agents|anthropic|claude|claude-code|developer-tools|llm|mcp|productivity","MIT License",2
"TheAlgorithms","Python","Python",222245,50793,985,3633,"All Algorithms implemented in Python",true,true,true,"https://thealgorithms.github.io/Python/","algorithm|algorithm-competitions|algorithms-implemented|algos|community-driven|education|hacktoberfest|interview|learn|practice|python|searches|sorting-algorithms|sorts","MIT License",8
"vuejs","vue","TypeScript",209978,33699,635,4716,"This is the repo for Vue 2. For Vue 3, go to https://github.com/vuejs/core",true,true,true,"http://v2.vuejs.org","framework|frontend|javascript|vue","MIT License",625
"ossu","computer-science","HTML",205331,25511,23,4438,"🎓 Path to a free self-taught education in Computer Science!",true,true,true,"https://cs.ossu.dev","awesome-list|computer-science|courses|curriculum","MIT License",1
"NousResearch","hermes-agent","Python",204365,36777,24123,340,"The agent that grows with you",true,true,true,"https://hermes-agent.nousresearch.com","ai|ai-agent|ai-agents|anthropic|chatgpt|claude|claude-code|clawdbot|codex|hermes|hermes-agent|llm|moltbot|nous-research|openai|openclaw","MIT License",0
"trekhleb","javascript-algorithms","JavaScript",196147,31052,400,3017,"📝 Algorithms and data structures implemented in JavaScript with explanations and links to further readings",true,false,true,"","algorithm|algorithms|computer-science|data-structures|interview|interview-preparation|javascript|javascript-algorithms","MIT License",1
"tensorflow","tensorflow","C++",195964,75188,3235,3885,"An Open Source Machine Learning Framework for Everyone",true,true,true,"https://tensorflow.org","deep-learning|deep-neural-networks|distributed|machine-learning|ml|neural-network|python|tensorflow","Apache License 2.0",0
"ultraworkers","claw-code","Rust",194379,109886,20,88,"An agent-managed museum exhibit, built in Rust with Gajae-Code / LazyCodex — developed and maintained with no human intervention.",true,true,true,"","","MIT License",1
"n8n-io","n8n","TypeScript",194277,58887,1482,2562,"Fair-code workflow automation platform with native AI capabilities. Combine visual building with custom code, self-host or cloud, 400+ integrations.",true,false,true,"https://n8n.io","ai|apis|automation|cli|data-flow|development|integration-framework|integrations|ipaas|low-code|low-code-platform|mcp|mcp-client|mcp-server|n8n|no-code|self-hosted|typescript|workflow|workflow-automation","Other",0
"ohmyzsh","ohmyzsh","Shell",188296,26375,566,6147,"🙃   A delightful community-driven (with 2,500+ contributors) framework for managing your zsh configuration. Includes 300+ optional plugins (rails, git, macOS, hub, docker, homebrew, node, php, python, etc), 140+ themes to spice up your morning, and an auto-update tool that makes it easy to keep up with the latest updates from the community.",true,true,true,"https://ohmyz.sh","cli|cli-app|oh-my-zsh|oh-my-zsh-plugin|oh-my-zsh-theme|ohmyzsh|plugin-framework|plugins|productivity|shell|terminal|theme|themes|zsh|zsh-configuration","MIT License",1
"microsoft","vscode","TypeScript",186861,40698,18822,3950,"Visual Studio Code",true,true,true,"https://code.visualstudio.com","editor|electron|microsoft|typescript|visual-studio-code","MIT License",0
"Significant-Gravitas","AutoGPT","Python",185187,46128,449,1199,"AutoGPT is the vision of accessible AI for everyone, to use and to build on. Our mission is to provide the tools, so that you can focus on what matters.",true,true,true,"https://agpt.co","agentic-ai|agents|ai|artificial-intelligence|autonomous-agents|claude|gpt|llama-api|llm|openai|python","Other",0
"CyC2018","CS-Notes","Unknown",184631,50870,196,3056,":books: 技术面试必备基础知识、Leetcode、计算机操作系统、计算机网络、系统设计",true,true,true,"http://cyc2018.xyz","algorithm|computer-science|cpp|interview|java|leetcode|python|system-design","No License",675
"getify","You-Dont-Know-JS","Unknown",184551,33510,2,4606,"A book series (2 published editions) on the JS language.",true,true,true,"https://www.amazon.com/dp/B085XXCJ7X","async|book|book-series|closures|education|es2015|es6|javascript|learn-to-code|programming|prototypes|training-materials|training-providers","Other",132
"jackfrued","Python-100-Days","Jupyter Notebook",183753,55682,702,3040,"Python - 100天从新手到大师",true,true,true,"","","No License",75
"multica-ai","andrej-karpathy-skills","Unknown",183434,18802,126,151,"A single CLAUDE.md file to improve Claude Code behavior, derived from Andrej Karpathy's observations on LLM coding pitfalls.",false,true,true,"","","No License",68
"DigitalPlatDev","FreeDomain","HTML",181043,3701,36,758,"DigitalPlat FreeDomain: Free Domain For Everyone",false,true,true,"https://domain.digitalplat.org","digitalplat|domain|domain-platform|domainname|domains|free|freedomain","GNU Affero General Public License v3.0",64
"massgravel","Microsoft-Activation-Scripts","Batchfile",181024,17346,2,2358,"Open-source Windows and Office activator featuring HWID, Ohook, TSforge, and Online KMS activation methods, along with advanced troubleshooting.",true,false,true,"https://massgrave.dev","activator|hwid|kms|kms38|massgrave|massgravel|microsoft|microsoft365|office|office365|ohook|powershell|tsforge|windows|windows-10|windows-11","GNU General Public License v3.0",16
"anomalyco","opencode","TypeScript",179759,22101,7009,423,"The open source coding agent.",true,true,true,"https://opencode.ai","","MIT License",0
"flutter","flutter","Dart",177608,30572,12925,4131,"Flutter makes it easy and fast to build beautiful apps for mobile and beyond",true,true,true,"https://flutter.dev","android|app-framework|cross-platform|dart|dart-platform|desktop|flutter|flutter-package|fuchsia|ios|linux-desktop|macos|material-design|mobile|mobile-development|skia|web|web-framework|windows","BSD 3-Clause ""New"" or ""Revised"" License",0
"avelino","awesome-go","Go",176553,13357,183,4374,"A curated list of awesome Go frameworks, libraries and software",true,false,true,"https://awesome-go.com","awesome|awesome-list|go|golang|golang-library|hacktoberfest","MIT License",0
"ollama","ollama","Go",174999,16750,3502,1097,"Get up and running with Kimi-K2.6, GLM-5.1, MiniMax, DeepSeek, gpt-oss, Qwen, Gemma and other models.",true,false,true,"https://ollama.com","deepseek|gemma|gemma3|glm|go|golang|gpt-oss|llama|llama3|llm|llms|minimax|mistral|ollama|qwen","MIT License",0
"github","gitignore","Unknown",174622,82379,72,5710,"A collection of useful .gitignore templates",false,false,true,"","git|gitignore","Creative Commons Zero v1.0 Universal",37
"twbs","bootstrap","MDX",174403,78774,278,5447,"The most popular HTML, CSS, and JavaScript framework for developing responsive, mobile first projects on the web.",true,true,true,"https://getbootstrap.com","bootstrap|css|css-framework|html|javascript|sass|scss","MIT License",0
"yt-dlp","yt-dlp","Python",173748,14656,2541,2070,"A feature-rich command-line audio/video downloader",true,true,true,"https://discord.gg/H5MNcFW63r","cli|downloader|python|sponsorblock|youtube-dl|youtube-downloader|yt-dlp","The Unlicense",0
"f","prompts.chat","HTML",164439,21288,60,1300,"f.k.a. Awesome ChatGPT Prompts. Share, discover, and collect prompts from the community. Free and open source — self-host for your organization with complete privacy.",true,true,true,"https://prompts.chat","ai|artificial-intelligence|awesome-list|chatgpt|chatgpt-prompts|claude|gemini|gpt|gpt-4|llm|machine-learning|nextjs|open-source|openai|prompt-engineering|prompts|prompts-chat|typescript","Other",0
"AUTOMATIC1111","stable-diffusion-webui","Python",163903,30372,2494,1405,"Stable Diffusion web UI",true,true,true,"","ai|ai-art|deep-learning|diffusion|gradio|image-generation|image2image|img2img|pytorch|stable-diffusion|text2image|torch|txt2img|unstable|upscaling|web","GNU Affero General Public License v3.0",117
"521xueweihan","HelloGitHub","Python",162935,12238,465,3706,":octocat: 分享 GitHub 上有趣、入门级的开源项目。Share interesting, entry-level open source projects on GitHub.",true,true,true,"https://hellogithub.com","awesome|github|hellogithub|python","No License",29
"huggingface","transformers","Python",161975,33620,2463,2798,"🤗 Transformers: the model-definition framework for state-of-the-art machine learning models in text, vision, audio, and multimodal models, for both inference and training. ",true,true,true,"https://huggingface.co/transformers","audio|deep-learning|deepseek|gemma|glm|hacktoberfest|llm|machine-learning|model-hub|natural-language-processing|nlp|pretrained-models|python|pytorch|pytorch-transformers|qwen|speech-recognition|transformer|vlm","Apache License 2.0",0
"jlevy","the-art-of-command-line","Unknown",161441,14826,256,4056,"Master the command line, in one page",true,true,true,"","bash|documentation|linux|macos|unix|windows","No License",732
"microsoft","markitdown","Python",160069,11237,822,591,"Python tool for converting files and office documents to Markdown.",true,true,true,"","autogen|autogen-extension|langchain|markdown|microsoft-office|openai|pdf","MIT License",3
"Snailclimb","JavaGuide","JavaScript",156648,46149,58,2973,"Java 面试 & 后端通用面试指南，覆盖计算机基础、数据库、分布式、高并发、系统设计与 AI 应用开发",true,true,true,"https://javaguide.cn","agent|ai|context-engineering|deepseek|interview|java|mcp|mysql|redis|redisson|skills|springai|system-design","Apache License 2.0",2
"anthropics","skills","Python",155905,18379,988,278,"Public repository for Agent Skills",true,false,true,"","agent-skills","No License",0
"langflow-ai","langflow","Python",150137,9355,989,1235,"Langflow is a powerful tool for building and deploying AI-powered agents and workflows.",true,true,true,"http://www.langflow.org","agents|chatgpt|generative-ai|large-language-models|multiagent|react-flow","MIT License",0
"mattpocock","skills","Shell",148356,12836,98,144,"Skills for Real Engineers. Straight from my .claude directory.",true,true,true,"","","MIT License",2
"airbnb","javascript","JavaScript",148084,26647,159,4986,"JavaScript Style Guide",true,false,true,"","arrow-functions|es2015|es2016|es2017|es2018|es6|eslint|javascript|linting|naming-conventions|style-guide|style-linter|styleguide|tc39","MIT License",72
"langgenius","dify","TypeScript",146775,23119,837,1172,"Production-ready platform for agentic workflow development.",true,false,true,"https://dify.ai","agent|agentic-ai|agentic-framework|agentic-workflow|ai|automation|gemini|genai|gpt|gpt-4|llm|low-code|mcp|nextjs|no-code|openai|orchestration|python|rag|workflow","Other",0
"Genymobile","scrcpy","C",144483,13318,2848,3140,"Display and control your Android device",true,false,true,"","android|c|ffmpeg|libav|mirroring|recording|screen|sdl2","Apache License 2.0",0
"open-webui","open-webui","Python",143246,20641,449,995,"User-friendly AI Interface (Supports Ollama, OpenAI API, ...)",true,false,true,"https://openwebui.com","ai|llm|llm-ui|llm-webui|llms|mcp|ollama|ollama-webui|open-webui|openai|openapi|rag|self-hosted|ui|webui","Other",2
"x1xhlol","system-prompts-and-models-of-ai-tools","Unknown",141248,34754,154,479,"FULL Augment Code, Claude Code, Cluely, CodeBuddy, Comet, Cursor, Devin AI, Junie, Kiro, Leap.new, Lovable, Manus, NotionAI, Orchids.app, Perplexity, Poke, Qoder, Replit, Same.dev, Trae, Traycer AI, VSCode Agent, Warp.dev, Windsurf, Xcode, Z.ai Code, Dia & v0. (And other Open Sourced) System Prompts, Internal Tools & AI Models",true,true,true,"","ai|bolt|cluely|copilot|cursor|cursorai|devin|github-copilot|lovable|open-source|perplexity|replit|system-prompts|trae|trae-ai|trae-ide|v0|vscode|windsurf|windsurf-ai","GNU General Public License v3.0",15
"ytdl-org","youtube-dl","Python",140616,10684,4128,5718,"Command-line program to download videos from YouTube.com and other video sites",true,true,true,"http://ytdl-org.github.io/youtube-dl/","","The Unlicense",128
"yangshun","tech-interview-handbook","TypeScript",140488,16641,46,3644,"Curated coding interview preparation materials for busy software engineers",true,false,true,"https://www.techinterviewhandbook.org","algorithm|algorithm-interview|algorithm-interview-questions|algorithms|behavioral-interviews|coding-interviews|interview-practice|interview-preparation|interview-questions|system-design","MIT License",83
"langchain-ai","langchain","Python",140346,23297,413,1349,"The agent engineering platform.",true,false,true,"https://docs.langchain.com/langchain/","agents|ai|ai-agents|anthropic|chatgpt|deepagents|enterprise|framework|gemini|generative-ai|langchain|langgraph|llm|multiagent|open-source|openai|pydantic|python|rag|typescript","MIT License",1
"vercel","next.js","JavaScript",140260,31278,4155,3552,"The React Framework",true,false,true,"https://nextjs.org","blog|browser|compiler|components|hybrid|nextjs|node|react|server-rendering|ssg|static|static-site-generator|universal|vercel","MIT License",0
"firecrawl","firecrawl","TypeScript",140043,8047,365,803,"The API to search, scrape, and interact with the web at scale. 🔥",true,true,true,"https://firecrawl.dev","ai|ai-agents|ai-crawler|ai-scraping|ai-search|crawler|data-extraction|html-to-markdown|llm|markdown|scraper|scraping|web-crawler|web-data|web-data-extraction|web-scraper|web-scraping|web-search|webscraping","GNU Affero General Public License v3.0",0
"microsoft","PowerToys","C",135707,8168,7301,2614,"Microsoft PowerToys is a collection of utilities that supercharge productivity and customization on Windows",true,true,true,"","advanced-paste|color-picker|command-palette|desktop|fancyzones|keyboard-manager|microsoft-powertoys|powerrename|powertoys|windows|windows-10|windows-11","MIT License",0
"golang","go","Go",134968,19027,10163,4330,"The Go programming language",true,true,true,"https://go.dev","go|golang|language|programming-language","BSD 3-Clause ""New"" or ""Revised"" License",1
"anthropics","claude-code","Python",134723,21751,8934,490,"Claude Code is an agentic coding tool that lives in your terminal, understands your codebase, and helps you code faster by executing routine tasks, explaining complex code, and handling git workflows - all through natural language commands.",true,false,true,"https://code.claude.com/docs/en/overview","","No License",1
"labuladong","fucking-algorithm","Markdown",134575,23610,3,2320,"Crack LeetCode, not only how, but also why. ",true,false,true,"https://labuladong.online/","algorithms|computer-science|data-structures|dynamic-programming|dynamic-programming-algorithm|interview-questions|kmp|leetcode","No License",119
"iptv-org","iptv","TypeScript",128865,7110,30,2782,"Collection of publicly available IPTV channels from all over the world",true,false,true,"https://iptv-org.github.io","iptv|m3u|playlist|streams|tv","The Unlicense",0
"clash-verge-rev","clash-verge-rev","TypeScript",128282,9311,436,949,"A modern GUI client based on Tauri, designed to run in Windows, macOS and Linux for tailored proxy experience",true,true,true,"https://www.clashverge.dev","clash|clash-meta|clash-verge|linux|mac|mihomo|tauri-app|windows","GNU General Public License v3.0",0
"Chalarangelo","30-seconds-of-code","JavaScript",128227,12475,0,3132,"Coding articles to level up your development skills",true,false,true,"https://30secondsofcode.org/","astro|awesome-list|css|education|es6-javascript|git|html|javascript|learn-to-code|learning-resources|nodejs|programming|snippets","Creative Commons Attribution 4.0 International",5
"krahets","hello-algo","Java",127979,15235,39,1331,"《Hello 算法》：动画图解、一键运行的数据结构与算法教程。支持简中、繁中、English、日本語，提供 Python, Java, C++, C, C#, JS, Go, Swift, Rust, Ruby, Kotlin, TS, Dart 等代码实现",true,true,true,"https://www.hello-algo.com","algo|algorithm|algorithms|book|data-structure|data-structures|data-structures-and-algorithms|dsa|education|leetcode|programming","Other",70
"excalidraw","excalidraw","TypeScript",126319,14169,3181,2368,"Virtual whiteboard for sketching hand-drawn like diagrams",true,true,true,"https://excalidraw.com","canvas|collaboration|diagrams|drawing|hacktoberfest|productivity|whiteboard","MIT License",1
"react","react-native","C++",126110,25182,1044,4187,"A framework for building native applications using React",true,true,true,"https://reactnative.dev","android|app-framework|cross-platform|ios|mobile|mobile-development|react|react-native","MIT License",0
"ripienaar","free-for-dev","HTML",124177,13083,14,4119,"A list of SaaS, PaaS and IaaS offerings that have free tiers of interest to devops and infradev",false,false,true,"https://free-for.dev/","awesome-list|free-for-developers","No License",3
"kubernetes","kubernetes","Go",123344,43300,2749,4404,"Production-Grade Container Scheduling and Management",true,true,true,"https://kubernetes.io","cncf|containers|go|kubernetes","Apache License 2.0",0
"electron","electron","C++",121804,17279,892,4824,":electron: Build cross-platform desktop apps with JavaScript, HTML, and CSS",true,true,true,"https://electronjs.org","c-plus-plus|chrome|css|electron|html|javascript|nodejs|v8|works-with-codespaces","MIT License",0
"Comfy-Org","ComfyUI","Python",118536,13872,4166,1257,"The most powerful and modular diffusion model GUI, api and backend with a graph/nodes interface.",true,true,true,"https://www.comfy.org/","ai|comfy|comfyui|python|pytorch|stable-diffusion","GNU General Public License v3.0",0
"ggml-org","llama.cpp","C++",118391,19990,1828,1205,"LLM inference in C/C++",true,true,true,"https://llama.app","ggml","MIT License",0
"nodejs","node","JavaScript",118024,35799,2421,4231,"Node.js JavaScript runtime ✨🐢🚀✨",true,true,true,"https://nodejs.org","javascript|js|linux|macos|mit|node|nodejs|runtime|windows","Other",0
"shadcn-ui","ui","TypeScript",117600,9172,2065,1270,"A set of beautifully-designed, accessible components and a code distribution platform. Works with your favorite frameworks. Open Source. Open Code.",true,false,true,"https://ui.shadcn.com","base-ui|components|laravel|nextjs|radix-ui|react|shadcn|tailwindcss|tanstack|ui|vite","MIT License",0
"garrytan","gstack","TypeScript",117249,17417,742,108,"Use Garry Tan's exact Claude Code setup: 23 opinionated tools that serve as CEO, Designer, Eng Manager, Release Manager, Doc Engineer, and QA",true,true,true,"","","MIT License",2
"justjavac","free-programming-books-zh_CN","Unknown",117195,28220,32,4618,":books: 免费的计算机编程类中文书籍，欢迎投稿",false,false,true,"http://weibo.com/justjavac","android|angular|books|free|ios|javascript|kotlin|pdf|programming|python|react|react-native|swift|vue","GNU General Public License v3.0",712
"rustdesk","rustdesk","Rust",117150,17754,120,2098,"An open-source remote desktop application designed for self-hosting, as an alternative to TeamViewer.",true,true,true,"https://rustdesk.com","android|anydesk|dart|flatpak|flutter|flutter-apps|ios|linux|macos|p2p|rdp|remote-control|remote-desktop|rust|rust-lang|teamviewer|vnc|wayland|windows","GNU Affero General Public License v3.0",0
"msitarzewski","agency-agents","Shell",116360,19068,85,257,"A complete AI agency at your fingertips - From frontend wizards to Reddit community ninjas, from whimsy injectors to reality checkers. Each agent is a specialized expert with personality, processes, and proven deliverables.",true,true,true,"","","MIT License",5
"github","spec-kit","Python",115915,10239,370,310,"💫 Toolkit to help you get started with Spec-Driven Development",true,true,true,"https://github.github.com/spec-kit/","ai|copilot|development|engineering|prd|spec|spec-driven","MIT License",1
"Shubhamsaboo","awesome-llm-apps","Python",115846,17228,3,789,"100+ AI Agent & RAG apps you can actually run — clone, customize, ship.",true,true,true,"https://www.theunwindai.com","agents|llms|python|rag","Apache License 2.0",13
"Hack-with-Github","Awesome-Hacking","Unknown",115170,10461,40,3741,"A collection of various awesome lists for hackers, pentesters and security researchers",false,false,true,"","android|awesome|bug-bounty|fuzzing|hacking|penetration-testing|pentesting-windows|reverse-engineering|security","Creative Commons Zero v1.0 Universal",51
"rust-lang","rust","Rust",114253,15030,12527,5855,"Empowering everyone to build reliable and efficient software.",true,true,true,"https://www.rust-lang.org","compiler|language|rust","Apache License 2.0",0
