organization,repo_name,language,stars,forks,open_issues,age_days,description,has_coc,has_contributing,has_workflows,homepage,topics,license,last_updated
"akullpp","awesome-java","Unknown",48324,7688,2,4371,"A curated list of awesome frameworks, libraries and software for the Java programming language.",true,true,true,"","awesome|awesome-list","Other",1
"ClickHouse","ClickHouse","C++",48320,8570,6221,3677,"ClickHouse® is a real-time analytics database management system",true,true,true,"https://clickhouse.com","ai|analytics|big-data|clickhouse|cloud-native|cpp|database|dbms|distributed|embedded|hacktoberfest|lakehouse|mpp|olap|rust|self-hosted|sql","Apache License 2.0",0
"bigskysoftware","htmx","JavaScript",48274,1603,662,2266,"</> htmx - high power tools for HTML",true,false,true,"https://htmx.org","hateoas|html|htmx|hyperscript|javascript|rest","Other",0
"type-challenges","type-challenges","TypeScript",48270,5273,33225,2165,"Collection of TypeScript type challenges with online judge",true,true,true,"https://tsch.js.org/","challenges|type|type-system|typescript","MIT License",42
"astral-sh","ruff","Rust",48257,2197,2036,1418,"An extremely fast Python linter and code formatter, written in Rust.",true,true,true,"https://docs.astral.sh/ruff","linter|pep8|python|python3|ruff|rust|rustpython|static-analysis|static-code-analysis|style-guide|styleguide","MIT License",0
"ReactiveX","RxJava","Java",48235,7585,17,4918,"RxJava – Reactive Extensions for the JVM – a library for composing asynchronous and event-based programs using observable sequences for the Java VM.",true,true,true,"https://dsc.gg/rxjava","flow|java|reactive-streams|rxjava","Apache License 2.0",1
"nilbuild","design-patterns-for-humans","Unknown",47975,5506,16,3418,"An ultra-simplified explanation to design patterns",true,true,true,"","architecture|computer-science|design-patterns|engineering|principles|software-engineering","No License",572
"moment","moment","JavaScript",47959,6995,304,5597,"Parse, validate, manipulate, and display dates in javascript.",true,true,true,"momentjs.com","","MIT License",682
"DovAmir","awesome-design-patterns","Unknown",47952,3275,25,2945,"A curated list of software and architecture related design patterns.",true,true,true,"","architecture|awesome|awesome-list|cloud-computing|design-patterns|gof-patterns|lists|microservices|resources","No License",610
"metabase","metabase","Clojure",47905,6606,4024,4163,"The easy-to-use open source Business Intelligence and Embedded Analytics tool that lets everyone work with data :bar_chart:",true,true,true,"https://metabase.com","analytics|bi|business-intelligence|businessintelligence|clojure|dashboard|data|data-analysis|data-visualization|database|metabase|mysql|postgres|postgresql|reporting|slack|sql-editor|visualization","Other",0
"CherryHQ","cherry-studio","TypeScript",47890,4545,1263,764,"AI productivity studio with smart chat, autonomous agents, and 300+ assistants. Unified access to frontier LLMs",true,true,true,"https://cherryai.com","agent-skills|ai-agent|awesome-skills|claude-code|codex|deepseek|hermes-agent|openclaw|skills|vibe-coding","GNU Affero General Public License v3.0",0
"brillout","awesome-react-components","Unknown",47861,3792,57,3655,"Curated List of React Components & Libraries.",true,true,true,"","awesome|awesome-list|react|react-component|react-components","Creative Commons Zero v1.0 Universal",152
"karan","Projects","Unknown",47765,10629,122,4741,":page_with_curl: A list of practical projects that anyone can solve in any programming language.",true,true,true,"https://twitter.com/karangoel","","MIT License",682
"minimaxir","big-list-of-naughty-strings","Python",47689,2159,108,3976,"The Big List of Naughty Strings is a list of strings which have a high probability of causing issues when used as user-input data.",true,true,true,"","","MIT License",800
"gogs","gogs","Go",47630,5076,1001,4518,"The painless way to host your own Git service",true,false,true,"https://gogs.io","docker|git|go|gogs|mysql|postgresql|raspberry-pi|self-hosted|source-code-management|sqlite3|version-control","MIT License",7
"pixijs","pixijs","TypeScript",47624,5039,349,4905,"The HTML5 Creation Engine: Create beautiful digital content with the fastest, most flexible 2D WebGL renderer.",true,true,true,"http://pixijs.com","canvas|canvas2d|data-visualization|game|glsl|javascript|pixi|pixijs|renderer|rendering|rendering-2d-graphics|rendering-engine|webgl","MIT License",8
"hesreallyhim","awesome-claude-code","Python",47459,4145,562,434,"A curated list of awesome skills, hooks, slash-commands, agent orchestrators, applications, and plugins for Claude Code by Anthropic",true,false,true,"","agent-skills|agentic-code|agentic-coding|ai-workflow-optimization|ai-workflows|anthropic|anthropic-claude|awesome|awesome-claude-code|awesome-list|awesome-lists|awesome-resources|claude|claude-code|coding-agent|coding-agents|coding-assistant|coding-assistants|llm","Other",61
"slidevjs","slidev","TypeScript",47409,2111,211,1890,"Presentation Slides for Developers",true,false,true,"https://sli.dev","markdown|presentation|slides|vite|vue|vueuse","MIT License",2
"oobabooga","textgen","Python",47381,5978,821,1284,"Open-source desktop app for local LLMs. Text, vision, tool-calling, OpenAI/Anthropic-compatible API. 100% private.",true,true,true,"https://localbench.substack.com","","GNU Affero General Public License v3.0",25
"discourse","discourse","Ruby",47345,8945,173,4915,"A platform for community discussion. Free, open, simple.",false,false,true,"https://www.discourse.org","discourse|ember|forum|javascript|postgresql|rails|ruby","GNU General Public License v2.0",0
"slab","quill","TypeScript",47202,3656,649,5080,"Quill is a modern WYSIWYG editor built for compatibility and extensibility",true,false,true,"https://quilljs.com","editor|quill|rich-text-editor|wysiwyg","BSD 3-Clause ""New"" or ""Revised"" License",337
"mudler","LocalAI","Go",47195,4179,200,1197,"LocalAI is the open-source AI engine. Run any model - LLMs, vision, voice, image, video - on any hardware. No GPU required.",true,true,true,"https://localai.io","agents|ai|api|audio-generation|decentralized|distributed|image-generation|libp2p|llama|llm|mamba|mcp|musicgen|object-detection|rerank|stable-diffusion|text-generation|tts","MIT License",0
"mvanhorn","last30days-skill","Python",47179,3915,55,155,"AI agent skill that researches any topic across Reddit, X, YouTube, HN, Polymarket, and the web - then synthesizes a grounded summary",true,true,true,"","ai-prompts|ai-skill|bluesky|claude|claude-code|clawhub|deep-research|hackernews|instagram|openclaw|polymarket|recency|reddit|research|social-media|tiktok|trends|twitter|web-search|youtube","MIT License",0
"KRTirtho","spotube","Dart",47175,2175,813,1959,"🎧 Open source music streaming app! Available for both desktop & mobile!",true,true,true,"https://spotube.cc/","android|android-client|android-music-player|desktop-client|fdroid|flutter|flutter-desktop|linux|macos|music|music-player|windows|youtube","Other",22
"tmux","tmux","C",47099,2717,28,4042,"tmux source code",true,false,true,"","","ISC License",0
"dypsilon","frontend-dev-bookmarks","Unknown",47078,5150,134,4753,"Manually curated collection of resources for frontend web developers.",true,true,true,"","awesome|awesome-list|frontend|list","No License",767
"typescript-cheatsheets","react","TypeScript",47078,4292,0,2947,"Cheatsheets for experienced React developers getting started with TypeScript",true,false,true,"https://react-typescript-cheatsheet.netlify.app","cheatsheet|guide|react|typescript","MIT License",29
"acmesh-official","acme.sh","Shell",47005,5617,1425,3836,"A pure Unix shell script ACME client for SSL / TLS certificate automation",true,false,true,"https://acme.sh","acme|acme-challenge|acme-protocol|acme-v2|ash|bash|buypass|certbot|lets-encrypt|posix|posix-sh|shell|ssl|ssl-certificate|ssl-certificates|tls|tls-certificate|zerossl","GNU General Public License v3.0",8
"square","okhttp","Kotlin",46993,9271,119,5087,"Square’s meticulous HTTP client for the JVM, Android, and GraalVM.",true,false,true,"https://square.github.io/okhttp/","android|graalvm|java|kotlin","Apache License 2.0",0
"coreybutler","nvm-windows","Go",46918,3842,89,4298,"A node.js version management utility for Windows. Ironically written in Go.",true,true,true,"","go|management|node|node-version-manager|nodejs|nvm|switch|version|version-manager|versioning|windows","MIT License",71
"serverless","serverless","JavaScript",46916,5730,1222,4085,"⚡ Serverless Framework – Effortlessly build apps that auto-scale, incur zero costs when idle, and require minimal maintenance using AWS Lambda and other managed cloud services.",true,false,true,"https://serverless.com","aws|aws-dynamodb|aws-lambda|azure-functions|google-cloud-functions|microservice|serverless|serverless-architectures|serverless-framework","Other",3
"GitHubDaily","GitHubDaily","Unknown",46903,4650,654,2736,"坚持分享 GitHub 上高质量、有趣实用的开源技术教程、开发者工具、编程网站、技术资讯。A list cool, interesting projects of GitHub.",true,true,true,"https://githubdaily.com","ai|algorithms-and-data-structures|backend|developer-tools|development|frontend|github|java|javascript|kubernetes|linux|markdown|open-source|python|tutorials|web","No License",178
"jeecgboot","JeecgBoot","Java",46900,16070,31,2770,"AI 低代码平台「低代码 + 零代码」双驱动！低代码可一键生成前后端代码;零代码可 5 分钟搭建系统;AI Skills 一句话画流程、设计表单、生成整套系统。内置 AI聊天、知识库、流程编排、MCP插件等，兼容主流大模型。引领「AI 生成 → 在线配置 → 代码生成 → 手工合并->AI修改」开发模式，消除 Java 项目 80% 的重复工作，提效而不失灵活。",true,true,true,"https://jeecg.com","activiti|agent|ai|antd|claude-code|cli|codegenerator|codex|flowable|langchain4j|llm|low-code|mcp|mybatis-plus|rag|skills|spring-ai|springboot|springcloud|vue3","Apache License 2.0",3
"v2ray","v2ray-core","Go",46899,8845,19,3949,"A platform for building proxies to bypass network restrictions.",true,false,true,"https://www.v2ray.com/","golang|http-proxy|proxy|shadowsocks|socks|socks5|v2ray|vmess","MIT License",64
"bevyengine","bevy","Rust",46892,4661,3277,2352,"A refreshingly simple data-driven game engine built in Rust",true,true,true,"https://bevy.org","bevy|game-development|game-engine|gamedev|open-source|rust","Apache License 2.0",0
"gedoor","legado","Kotlin",46873,5840,18,2593,"Legado 3.0 Book Reader with powerful controls & full functions❤️阅读3.0, 阅读是一款可以自定义来源阅读网络内容的工具，为广大网络文学爱好者提供一种方便、快捷舒适的试读体验。",false,false,true,"","","No License",31
"Aider-AI","aider","Python",46771,4658,1664,1145,"aider is AI pair programming in your terminal",true,true,true,"https://aider.chat/","anthropic|chatgpt|claude-3|cli|command-line|gemini|gpt-3|gpt-35-turbo|gpt-4|gpt-4o|llama|openai|sonnet","Apache License 2.0",36
"asgeirtj","system_prompts_leaks","JavaScript",46628,7638,24,420,"Extracted system prompts from Anthropic - Claude Fable 5, Opus 4.8, Claude Code, Claude Design. OpenAI - ChatGPT 5.5 Thinking, GPT 5.5 Instant, Codex. Google - Gemini 3.5 Flash, 3.1 Pro, Antigravity. xAI - Grok, Cursor, Copilot, VS Code, Perplexity, and more. Updated regularly.",true,false,true,"https://asgeirtj.github.io/system_prompts_leaks/","ai|ai-agents|anthropic|awesome|chatbot|chatgpt|claude|claude-code|codex|deep-learning|education|gemini|generative-ai|google|llm|machine-learning|nlp|open-source|openai|prompt-engineering","Creative Commons Zero v1.0 Universal",0
"lukasz-madon","awesome-remote-job","Unknown",46530,4651,43,4195,"A curated list of awesome remote jobs and resources. Inspired by https://github.com/vinta/awesome-python",true,true,true,"","awesome|awesome-list|list","No License",50
"Asabeneh","30-Days-Of-JavaScript","JavaScript",46505,10445,367,2378,"30 days of JavaScript programming challenge is a step-by-step guide to learn JavaScript programming language in 30 days. This challenge may take more than 100 days,  please just follow your own pace. These videos may help too: https://www.youtube.com/channel/UC7PNRuno1rzYPb1xLa4yktw",true,true,true,"","30daysofjavascript|angular|challenge|css|d3|d3js|html|javascript|javascript-for-everyone|js|json|node|nodejs|programming|react|redux|typescript|vue|webdevelopment|website","No License",203
"upscayl","upscayl","TypeScript",46444,2296,55,1428,"🆙 Upscayl - #1 Free and Open Source AI Image Upscaler for Linux, MacOS and Windows.",true,false,true,"https://upscayl.org","ai|electron|esrgan|gigapixel|gigapixel-images|image|image-upscaling|topaz|upscale|upscalerimage|upscayl","GNU Affero General Public License v3.0",43
"prisma","prisma","TypeScript",46410,2251,2629,2564,"Next-generation ORM for Node.js & TypeScript | PostgreSQL, MySQL, MariaDB, SQL Server, SQLite, MongoDB and CockroachDB",true,true,true,"https://www.prisma.io","cockroachdb|database|javascript|mariadb|mongo|mongodb|mongodb-orm|mssql|mysql|nodejs|orm|postgres|postgresql|prisma|prisma-client|query-builder|sql-server|sqlite|sqlserver|typescript","Apache License 2.0",2
"microsoft","monaco-editor","JavaScript",46257,4083,830,3672,"A browser based code editor",true,false,true,"https://microsoft.github.io/monaco-editor/","browser|editor|monaco-editor|typescript|vscode","MIT License",2
"LeCoupa","awesome-cheatsheets","JavaScript",46100,6707,137,3152,"👩‍💻👨‍💻 Awesome cheatsheets for popular programming languages, frameworks and development tools. They include everything you should know in one single file.",true,true,true,"https://lecoupa.github.io/awesome-cheatsheets/","backend|bash|cheatsheet|cheatsheets|database|django|docker|feathersjs|frontend|javascript|kubernetes|language|nodejs|php|programming-language|redis|sailsjs|vim|vuejs|xcode","MIT License",76
"ziishaned","learn-regex","Unknown",46089,6159,65,3262,"Learn regex the easy way",true,true,true,"https://gum.co/learn-regex","learn-regex|regex|regular-expression","MIT License",306
"anthropics","claude-cookbooks","Jupyter Notebook",46045,5416,264,1047,"A collection of notebooks/recipes showcasing some fun and effective ways of using Claude.",true,true,true,"","","MIT License",18
"apache","airflow","Python",45957,17307,1708,4093,"Apache Airflow - A platform to programmatically author, schedule, and monitor workflows",true,true,true,"https://airflow.apache.org/","airflow|apache|apache-airflow|automation|dag|data-engineering|data-integration|data-orchestrator|data-pipelines|data-science|elt|etl|machine-learning|mlops|orchestration|python|scheduler|workflow|workflow-engine|workflow-orchestration","Apache License 2.0",0
"calcom","cal.diy","TypeScript",45908,14241,1303,1923,"Scheduling infrastructure for absolutely everyone.",true,false,true,"https://cal.diy","next-auth|nextjs|open-source|postgresql|prisma|t3-stack|tailwindcss|trpc|turborepo|typescript|zod","MIT License",1
"android","architecture-samples","Kotlin",45730,11862,221,3795,"A collection of samples to discuss and showcase different architectural tools and patterns for Android apps.",true,true,true,"","android|android-architecture|samples","Apache License 2.0",1
"RocketChat","Rocket.Chat","TypeScript",45721,13685,3796,4057,"The Secure CommsOS™ for mission-critical operations",true,true,true,"https://rocket.chat/","chat|collaboration|foss|free|hacktoberfest|javascript|meteor|mit|real-time|slack|webrtc","Other",0
"docker","awesome-compose","HTML",45696,8217,395,2326,"Awesome Docker Compose samples",true,false,true,"https://docs.docker.com/compose/","awesome|awesome-list|docker-compose","Creative Commons Zero v1.0 Universal",7
"exo-explore","exo","Python",45682,3281,274,733,"Run frontier AI locally.",true,true,true,"","","Apache License 2.0",4
"zhayujie","CowAgent","Python",45643,10237,19,1420,"Open-source super AI assistant & Agent Harness. Plans tasks, runs tools and skills, self-evolves with memory and knowledge. Multi-model, multi-channel. Lightweight, extensible, one-line install. (formerly chatgpt-on-wechat)",true,true,true,"https://cowagent.ai","ai|ai-agent|ai-agents|chatgpt-on-wechat|claude|claude-code|codex|cowagent|deepseek|harness|llm|mcp|multi-agent|openai|openclaw|skills","MIT License",0
"coqui-ai","TTS","Python",45638,6127,8,2229,"🐸💬 - a deep learning toolkit for Text-to-Speech, battle-tested in research and production",true,true,true,"http://coqui.ai","deep-learning|glow-tts|hifigan|melgan|multi-speaker-tts|python|pytorch|speaker-encoder|speaker-encodings|speech|speech-synthesis|tacotron|text-to-speech|tts|tts-model|vocoder|voice-cloning|voice-conversion|voice-synthesis","Mozilla Public License 2.0",680
"hiroi-sora","Umi-OCR","Python",45593,4488,351,1552,"OCR software, free and offline. 开源、免费的离线OCR软件。支持截屏/批量导入图片，PDF文档识别，排除水印/页眉页脚，扫描/生成二维码。内置多国语言库。",true,true,true,"","ocr|ocr-python|paddleocr|qml|qt|screenshot|umi-ocr","MIT License",219
"google","zx","JavaScript",45583,1270,53,1879,"A tool for writing better scripts",true,true,true,"https://google.github.io/zx/","bash|child-process|cli|exec|javascript|nodejs|pipe|shell|spawn","Apache License 2.0",15
"ColorlibHQ","AdminLTE","CSS",45479,18203,2,4567,"AdminLTE - Free admin dashboard template based on Bootstrap 5",true,true,true,"https://adminlte.io","admin|admin-dashboard|admin-dashboard-template|admin-dashboard-ui|admin-panel|admin-template|admin-ui|astro-template|bootstrap|bootstrap-admin-panel|bootstrap5|css|dashboard|dashboard-template|dashboards|html","MIT License",1
"jestjs","jest","TypeScript",45458,6664,229,4583,"Delightful JavaScript Testing.",true,true,true,"https://jestjs.io","easy|expectation|facebook|immersive|javascript|painless|painless-javascript-testing|snapshot|testing","MIT License",0
"9001","copyparty","Python",45387,1848,269,2589,"Portable file server with accelerated resumable uploads, dedup, WebDAV, SFTP, FTP, TFTP, zeroconf, media indexer, thumbnails++ all in one file",true,false,true,"","copyparty|file-server|file-sharing|file-upload-server|ftp-server|nas-frontend|tftp-server|webdav-server","MIT License",1
"iina","iina","Swift",45377,2851,1880,3477,"The modern video player for macOS.",true,false,true,"https://iina.io","hacktoberfest|macos|mpv|swift|video|video-player","GNU General Public License v3.0",0
"Leaflet","Leaflet","JavaScript",45263,6139,567,5757,"🍃 JavaScript library for mobile-friendly interactive maps 🇺🇦",true,true,false,"https://leafletjs.com","javascript|leaflet|maps","BSD 2-Clause ""Simplified"" License",5
"microsoft","qlib","Python",45251,7206,447,2143,"Qlib is an AI-oriented Quant investment platform that aims to use AI tech to empower Quant Research, from exploring ideas to implementing productions. Qlib supports diverse ML modeling paradigms, including supervised learning, market dynamics modeling, and RL, and is now equipped with https://github.com/microsoft/RD-Agent to automate R&D process.",true,true,true,"https://qlib.readthedocs.io/en/latest/","algorithmic-trading|auto-quant|deep-learning|finance|fintech|investment|machine-learning|paper|platform|python|quant|quant-dataset|quant-models|quantitative-finance|quantitative-trading|research|research-paper|stock-data","MIT License",66
"usebruno","bruno","JavaScript",45192,2623,1738,1369,"Opensource IDE For Exploring and Testing API's (lightweight alternative to Postman/Insomnia)",true,false,true,"https://www.usebruno.com/","api-client|api-testing|automation|developer-tools|git|graphql-client|http-client|javascript|openapi|openapi3|opensource|rest-api|testing|testing-tools","MIT License",1
"KeygraphHQ","shannon","TypeScript",45177,5238,21,273,"Shannon is an autonomous, white-box AI pentester for web applications and APIs. It analyzes your source code, identifies attack vectors, and executes real exploits to prove vulnerabilities before they reach production.",true,true,true,"https://keygraph.io/","penetration-testing|pentesting|security-audit|security-automation|security-tools","GNU Affero General Public License v3.0",4
"isocpp","CppCoreGuidelines","CSS",45130,5550,250,3965,"The C++ Core Guidelines are a set of tried-and-true guidelines, rules, and best practices about coding in C++",true,true,true,"http://isocpp.github.io/CppCoreGuidelines/CppCoreGuidelines","","Other",12
"SimplifyJobs","Summer2026-Internships","Python",45096,3181,33,2226,"Summer 2026 software engineering, data science, AI, quant, product management, and hardware internship postings. Updated daily by Simplify and Pitt CSC.",true,false,true,"https://swelist.com/","data-science|fall-2026|github|internship|internships|interview-preparation|jobs|software-engineering|university","No License",0
"streamlit","streamlit","Python",45092,4304,1286,2500,"Streamlit — A faster way to build and share data apps.",true,false,true,"https://streamlit.io","data-analysis|data-science|data-visualization|deep-learning|developer-tools|machine-learning|python|streamlit","Apache License 2.0",0
"jgm","pandoc","Haskell",45090,3908,1068,5943,"Universal markup converter",true,true,true,"https://pandoc.org","commonmark|converter|document|haskell|markdown|markup|pandoc|presentation|publishing","GNU General Public License v2.0",4
"roboflow","supervision","Python",45026,4007,95,1307,"We write your reusable computer vision tools. 💜",true,true,true,"https://supervision.roboflow.com","classification|coco|computer-vision|deep-learning|hacktoberfest|image-processing|instance-segmentation|low-code|machine-learning|metrics|object-detection|oriented-bounding-box|pascal-voc|python|pytorch|tensorflow|tracking|video-processing|yolo","MIT License",0
"cli","cli","Go",45025,8613,1015,2459,"GitHub’s official command line tool",true,true,true,"https://cli.github.com","cli|git|github-api-v4|golang","MIT License",1
"helix-editor","helix","Rust",45001,3571,1557,2217,"A post-modern modal text editor.",true,true,true,"https://helix-editor.com","kakoune|rust|text-editor|vim","Mozilla Public License 2.0",3
"zhongyang219","TrafficMonitor","C++",44989,3702,1330,3254,"这是一个用于显示当前网速、CPU及内存利用率的桌面悬浮窗软件，并支持任务栏显示，支持更换皮肤。",true,true,true,"","","Other",82
"milvus-io","milvus","Go",44983,4094,922,2476,"Milvus is a high-performance, cloud-native vector database built for scalable vector ANN search",true,true,true,"https://milvus.io","anns|cloud-native|diskann|distributed|embedding-database|embedding-similarity|embedding-store|faiss|golang|hnsw|image-search|llm|nearest-neighbor-search|rag|vector-database|vector-search|vector-similarity|vector-store","Apache License 2.0",0
"DIYgod","RSSHub","TypeScript",44956,9965,358,3008,"🧡 Everything is RSSible",true,true,true,"https://docs.rsshub.app","bilibili|douban|dribbble|instagram|lofter|pixiv|rss|rsshub|spotify|telegram|tiktok|twitter|v2ex|wechat|weibo|ximalaya|youtube|zhihu","GNU Affero General Public License v3.0",0
"grpc","grpc","C++",44928,11167,1346,4219,"C++ based gRPC (C++, Python, Ruby, Objective-C, PHP, C#)",true,true,false,"https://grpc.io","","Apache License 2.0",0
"GitSquared","edex-ui","JavaScript",44925,3135,6,3437,"A cross-platform, customizable science fiction terminal emulator with advanced monitoring & touchscreen support.",true,false,true,"","desktop|edex-ui|electron|linux|macos|nodejs|science-fiction|shell|terminal|touchscreen|tron|unixporn|windows","GNU General Public License v3.0",1712
"pyenv","pyenv","Shell",44923,3252,56,5048,"Simple Python version management",true,true,true,"","python|shell","MIT License",1
"HKUDS","nanobot","Python",44798,7897,863,146,"Lightweight, open-source AI agent for your tools, chats, and workflows.",true,true,true,"https://nanobot.wiki","ai|ai-agent|ai-agents|anthropic|chatgpt|claude|claude-code|codex|codex-cli|llm|nanobot|openai|openclaw","MIT License",0
"meteor","meteor","JavaScript",44793,5244,421,5273,"Meteor, the JavaScript App Platform",true,true,true,"https://meteor.com","build-system|framework|hacktoberfest|javascript|meteor|mongodb|nodejs|npm|react|reactive-programming|realtime|rpc|zero-configuration","Other",1
"react-hook-form","react-hook-form","TypeScript",44780,2422,48,2671,"📋 React Hooks for form state management and validation (Web + React Native)",true,true,true,"https://react-hook-form.com","dx|form-builder|forms|react-hooks|react-native|reactjs|typescript|ux|validation","MIT License",7
"siyuan-note","siyuan","TypeScript",44690,2844,302,2127,"A privacy-first, self-hosted, fully open source personal knowledge management software, written in typescript and golang.",true,false,true,"https://b3log.org/siyuan","ai-agent|digital-garden|electron|knowledge-base|knowledge-graph|local-first|markdown|mcp|note-taking|notebook|notes-app|pdf|pkm|s3|self-hosted|siyuan|webdav|wiki","GNU Affero General Public License v3.0",0
"sudheerj","reactjs-interview-questions","JavaScript",44660,10365,15,2949,"List of top 500 ReactJS Interview Questions & Answers....Coding exercise questions are coming soon!!",true,true,true,"","interview-preparation|interview-questions|javascript|javascript-applications|javascript-framework|javascript-interview-questions|react|react-interview-questions|react-native|react-router|react16|reactjs|redux","MIT License",61
"vercel","hyper","TypeScript",44630,3564,1043,3648,"A terminal built on web technologies",true,false,true,"https://hyper.is","css|html|hyper|javascript|linux|macos|react|terminal|terminal-emulators","MIT License",5
"ChromeDevTools","chrome-devtools-mcp","TypeScript",44571,2888,88,289,"Chrome DevTools for coding agents",true,false,true,"https://npmjs.org/package/chrome-devtools-mcp","browser|chrome|chrome-devtools|debugging|devtools|mcp|mcp-server|puppeteer","Apache License 2.0",0
