organization,repo_name,language,stars,forks,open_issues,age_days,description,has_coc,has_contributing,has_workflows,homepage,topics,license,last_updated
"apache","superset","TypeScript",73548,17734,911,3994,"Apache Superset is a Data Visualization and Data Exploration Platform",true,true,true,"https://superset.apache.org/","analytics|apache|apache-superset|asf|bi|business-analytics|business-intelligence|data-analysis|data-analytics|data-engineering|data-science|data-visualization|data-viz|flask|python|react|sql-editor|superset","Apache License 2.0",0
"obsproject","obs-studio","C",73495,9382,1113,4652,"OBS Studio - Free and open source software for live streaming and screen recording",true,true,true,"https://obsproject.com","c|c-plus-plus|directshow|facebook-live|ffmpeg|game-capture|live-streaming|screen-capture|twitch-tv|video-recording|youtube-live","GNU General Public License v2.0",0
"twitter","the-algorithm","Scala",73480,13274,515,1188,"Source code for the X Recommendation Algorithm",true,false,true,"https://blog.twitter.com/engineering/en_us/topics/open-source/2023/twitter-recommendation-algorithm","","GNU Affero General Public License v3.0",292
"python","cpython","Python",73471,34786,9433,3424,"The Python programming language",true,true,true,"https://www.python.org","","Other",0
"PKUFlyingPig","cs-self-learning","HTML",73364,7889,151,1711,"计算机自学指南",true,true,true,"https://csdiy.wiki","","MIT License",123
"CompVis","stable-diffusion","Jupyter Notebook",73142,10592,616,1417,"A latent text-to-image diffusion model",true,true,true,"https://ommer-lab.com/research/latent-diffusion-models/","","Other",739
"abi","screenshot-to-code","Python",73087,8991,124,956,"Drop in a screenshot and convert it to clean code (HTML/Tailwind/React/Vue)",true,true,true,"https://screenshottocode.com","","MIT License",2
"josephmisiti","awesome-machine-learning","Python",73080,15510,14,4365,"A curated list of awesome Machine Learning frameworks, libraries and software.",true,false,true,"","","Other",9
"thedaviddias","Front-End-Checklist","MDX",73053,6652,3,3176,"🗂 The essential checklist for modern web development, for humans and AI agents",true,false,true,"https://frontendchecklist.io","ai-agent|ai-agents|checklist|css|front-end-developer-tool|front-end-development|frontend|guidelines|html|javascript|lists|reference|resources|rules|web-development","No License",9
"AppFlowy-IO","AppFlowy","Dart",73017,5540,1038,1837,"Bring projects, wikis, and teams together with AI. AppFlowy is the AI collaborative workspace where you achieve more without losing control of your data. The leading open source Notion alternative.",true,true,true,"https://appflowy.com","blog|confluence-alternative|content-management|content-services|documentation|flutter|note-taking|notion-alternative|project-management|task-management|team-collaboration|wiki","GNU Affero General Public License v3.0",1
"safishamsi","graphify","Python",72980,7316,390,85,"AI coding assistant skill (Claude Code, Codex, OpenCode, Cursor, Gemini CLI, and more). Turn any folder of code, SQL schemas, R scripts, shell scripts, docs, papers, images, or videos into a queryable knowledge graph. App code + database schema + infrastructure in one graph.",true,true,true,"https://graphifylabs.ai/","antigravity|claude-code|codex|gemini|graphrag|knowledge-graph|leiden|openclaw|rag|skills|tree-sitter","MIT License",0
"hiyouga","LlamaFactory","Python",72606,8877,1056,1126,"Unified Efficient Fine-Tuning of 100+ LLMs & VLMs (ACL 2024)",true,false,true,"https://llamafactory.readthedocs.io","agent|ai|deepseek|fine-tuning|gemma|gpt|instruction-tuning|large-language-models|llama|llama3|llm|lora|moe|nlp|peft|qlora|quantization|qwen|rlhf|transformers","Apache License 2.0",1
"strapi","strapi","TypeScript",72551,9774,552,3923,"🚀 Strapi is the leading open-source headless CMS. It’s 100% JavaScript/TypeScript, fully customizable, and developer-first.",true,true,true,"https://strapi.io","api|cms|cms-framework|content-management|content-management-system|customizable|dashboard|graphql|hacktoberfest|headless-cms|jamstack|javascript|mysql|no-code|nodejs|posgresql|rest|strapi|typescript","Other",0
"Eugeny","tabby","TypeScript",72422,4088,2730,3473,"A terminal for a more modern age",true,true,true,"https://tabby.sh","serial|ssh-client|telnet-client|terminal|terminal-emulators","MIT License",4
"daytonaio","daytona","Unknown",72367,5663,452,872,"Daytona is a Secure and Elastic Infrastructure for Running AI-Generated Code",true,true,true,"https://daytona.io","agentic-workflow|ai|ai-agents|ai-runtime|ai-sandboxes|code-execution|code-interpreter|developer-tools","No License",2
"binhnguyennus","awesome-scalability","Unknown",72058,7024,23,3104,"The Patterns of Scalable, Reliable, and Performant Large-Scale Systems",false,false,true,"","architecture|awesome|awesome-list|backend|big-data|computer-science|design-patterns|devops|distributed-systems|interview|interview-practice|interview-questions|lists|machine-learning|programming|resources|scalability|system|system-design|web-development","MIT License",174
"nexu-io","open-design","TypeScript",72025,8154,458,60,"🎨 Local-first, open-source Claude Design alternative. 🖥️ Native desktop app. ⚡ 259+ Skills · ✨ 142+ Design Systems 🖼️ Web · desktop · mobile prototypes · slides · images · videos · HyperFrames 📦 Sandboxed preview · HTML/PDF/PPTX/MP4 export 🤖 Claude Code / OpenClaw / Codex / Cursor / OpenCode / Qwen / Copilot / Hermes / Kimi & 17+ CLIs.",true,true,true,"https://open-design.ai","agent-skills|ai-agents|ai-design|byok|claude-code-for-design|claude-design|codex-design|coding-agents|cursor-design|design-systems|design-tools|desktop-app|figma-alternative|generative-ai|hermes-agent|local-first|no-code|prototyping|ui-generator|vibe-coding","Apache License 2.0",0
"fffaraz","awesome-cpp","Unknown",71987,8302,310,4363,"A curated list of awesome C++ (or C) frameworks, libraries, resources, and shiny things. Inspired by awesome-... stuff.",true,false,true,"http://fffaraz.github.io/awesome-cpp/","awesome|awesome-list|c|c-plus-plus|cpp|cpp-library|cppcon|libraries|list|lists|programming-tutorial|resources","MIT License",27
"hakimel","reveal.js","JavaScript",71827,16810,908,5499,"The HTML Presentation Framework",true,true,true,"https://revealjs.com","presentations|slides|slideshow","MIT License",37
"danielmiessler","SecLists","PHP",71806,25053,9,5242,"SecLists is the security tester's companion. It's a collection of multiple types of lists used during security assessments, collected in one place. List types include usernames, passwords, URLs, sensitive data patterns, fuzzing payloads, web shells, and many more.",true,true,true,"https://www.owasp.org/index.php/OWASP_Internet_of_Things_Project","","MIT License",2
"pallets","flask","Python",71765,16886,6,5926,"The Python micro framework for building web applications.",true,false,true,"https://flask.palletsprojects.com","flask|jinja|pallets|python|web-framework|werkzeug|wsgi","BSD 3-Clause ""New"" or ""Revised"" License",17
"moby","moby","Go",71751,18959,3793,4908,"The Moby Project - a collaborative project for the container ecosystem to assemble container-based systems",true,true,true,"https://mobyproject.org/","containers|docker|go|golang","Apache License 2.0",1
"paperclipai","paperclip","TypeScript",71701,13359,4893,117,"The open-source app everyone uses to manage agents at work",true,true,true,"https://paperclip.ing","","MIT License",0
"protocolbuffers","protobuf","C++",71419,16171,261,4323,"Protocol Buffers - Google's data interchange format",true,true,true,"http://protobuf.dev","marshalling|protobuf|protobuf-runtime|protoc|protocol-buffers|protocol-compiler|rpc|serialization","Other",0
"opendatalab","MinerU","Python",71032,5978,28,849,"Transforms complex documents like PDFs and Office docs into LLM-ready markdown/JSON for your Agentic workflows.",true,true,true,"https://opendatalab.github.io/MinerU/","ai4science|document-analysis|docx|extract-data|layout-analysis|ocr|parser|pdf|pdf-converter|pdf-extractor-llm|pdf-extractor-pretrain|pdf-extractor-rag|pdf-parser|pptx|python|xlsx","Other",0
"binary-husky","gpt_academic","Python",70992,8362,329,1195,"为GPT/GLM等LLM大语言模型提供实用化交互接口，特别优化论文阅读/润色/写作体验，模块化设计，支持自定义快捷按钮&函数插件，支持Python和C++等项目剖析&自译解功能，PDF/LaTex论文翻译&总结功能，支持并行问询多种LLM模型，支持chatglm3等本地模型。接入通义千问, deepseekcoder, 讯飞星火, 文心一言, llama2, rwkv, claude2, moss等。",true,true,true,"https://github.com/binary-husky/gpt_academic/wiki/online","academic|chatglm-6b|chatgpt|gpt-4|large-language-models","GNU General Public License v3.0",153
"nektos","act","Go",70880,1963,341,2733,"Run your GitHub Actions locally 🚀",true,true,true,"https://nektosact.com","ci|devops|github-actions|golang","MIT License",26
"juliangarnier","anime","JavaScript",70471,4756,110,3758,"JavaScript animation engine",true,true,true,"https://animejs.com","animation|anime|canvas|css|javascript|javascript-library|svg","MIT License",5
"NationalSecurityAgency","ghidra","Java",70199,7697,1862,2675,"Ghidra is a software reverse engineering (SRE) framework",true,true,true,"https://www.nsa.gov/ghidra","disassembler|reverse-engineering|software-analysis","Apache License 2.0",1
"swiftlang","swift","Swift",70110,10747,9051,3900,"The Swift Programming Language",true,false,true,"https://swift.org","","Apache License 2.0",0
"toeverything","AFFiNE","TypeScript",69846,4985,645,1427,"There can be more than Notion and Miro. AFFiNE(pronounced [ə‘fain]) is a next-gen knowledge base that brings planning, sorting and creating all together. Privacy first, open-source, customizable and ready to use. ",true,true,true,"https://affine.pro","app|crdt|editor|electron|knowledge-base|markdown|miro|notes|notion|notion-alternative|rust|rust-lang|rust-language|table|tableview|whiteboard|wiki|workspace","Other",0
"unclecode","crawl4ai","Python",69815,7148,117,779,"🚀🤖 Crawl4AI: Open-source LLM Friendly Web Crawler & Scraper. Don't be shy, join here: https://discord.gg/jP8KfhDhyN",true,true,true,"https://crawl4ai.com","","Apache License 2.0",0
"OpenBB-finance","OpenBB","Python",69765,7054,67,2015,"Financial data platform for analysts, quants and AI agents.",true,true,true,"https://openbb.co","ai|crypto|derivatives|economics|equity|finance|fixed-income|machine-learning|openbb|options|python|quantitative-finance|stocks","Other",2
"prakhar1989","awesome-courses","Unknown",69343,8377,63,4242,":books: List of awesome university courses for learning Computer Science!",true,true,true,"","awesome|awesome-list|computer-science|courses","No License",1150
"expressjs","express","JavaScript",69249,23889,214,6210,"Fast, unopinionated, minimalist web framework for node.",true,false,true,"https://expressjs.com","express|javascript|nodejs|server","MIT License",11
"FoundationAgents","MetaGPT","Python",69075,8815,135,1093,"🌟 The Multi-Agent Framework: First AI Software Company, Towards Natural Language Programming",true,true,true,"https://atoms.dev/","agent|gpt|llm|metagpt|multi-agent","MIT License",157
"ansible","ansible","Python",69066,24098,804,5226,"Ansible is a radically simple IT automation platform that makes your applications and systems easier to deploy and maintain. Automate everything from code deployment to network configuration to cloud management, in a language that approaches plain English, using SSH, with no agents to install on remote systems. https://docs.ansible.com.",true,true,true,"https://www.ansible.com/","ansible|python","GNU General Public License v3.0",0
"Egonex-AI","Understand-Anything","TypeScript",68672,5672,255,104,"Graphs that teach > graphs that impress. Turn any code into an interactive knowledge graph you can explore, search, and ask questions about. Works with Claude Code, Codex, Cursor, Copilot, Gemini CLI, and more.",true,true,true,"https://understand-anything.com","antigravity-skills|business-knowledge|claude-code|claude-skills|codebase-analysis|codex|codex-skills|developer-tools-ai-agent|gemini-cli-skills|karpathy-llm-wiki|knowledge-base|knowledge-graph|memory|opencode-skills|pi-agent|understandcode|vibe-coding","MIT License",4
"shareAI-lab","learn-claude-code","Python",68671,11179,41,363,"Bash is all you need -  A nano claude code–like 「agent harness」, built from 0 to 1",true,true,true,"https://learn.shareai.run","agent|agent-development|ai-agent|claude|claude-code|educational|llm|python|teaching|tutorial","MIT License",1
"base","node","Shell",68499,3252,21,1242,"Everything required to run your own Base node",true,true,true,"https://base.org","","MIT License",1
"chrislgarry","Apollo-11","Assembly",68165,7701,132,4468,"Original Apollo 11 Guidance Computer (AGC) source code for the command and lunar modules.",true,true,true,"","agc|apollo|hacktoberfest|nasa","Other",156
"microsoft","ai-agents-for-beginners","Jupyter Notebook",68078,22580,15,576,"12 Lessons to Get Started Building AI Agents",true,true,true,"https://aka.ms/ai-agents-beginners","agentic-ai|agentic-framework|agentic-rag|ai-agents|ai-agents-framework|autogen|generative-ai|semantic-kernel","MIT License",2
"chartjs","Chart.js","JavaScript",67541,11939,570,4850,"Simple HTML5 Charts using the <canvas> tag",true,true,true,"https://www.chartjs.org/","canvas|chart|graph|html5|html5-charts|javascript","MIT License",31
"unslothai","unsloth","Python",67486,6065,1013,941,"Unsloth Studio is a web UI for training and running open models like Gemma 4, Qwen3.6, DeepSeek, gpt-oss locally.",true,false,true,"https://unsloth.ai/docs","agent|deepseek|fine-tuning|gemma|gemma3|gpt-oss|llama|llama3|llm|llms|mistral|openai|qwen|reinforcement-learning|self-hosted|text-to-speech|tts|ui|unsloth","Apache License 2.0",0
"666ghj","MiroFish","Python",67372,10501,327,213,"A Simple and Universal Swarm Intelligence Engine, Predicting Anything. 简洁通用的群体智能引擎，预测万物",true,true,true,"https://mirofish.ai","agent-memory|financial-forecasting|future-prediction|knowledge-graph|llms|multi-agent-simulation|public-opinion-analysis|python3|social-prediction|swarm-intelligence","GNU Affero General Public License v3.0",34
"addyosmani","agent-skills","Shell",67279,7267,147,132,"Production-grade engineering skills for AI coding agents.",true,true,true,"","agent-skills|antigravity|antigravity-ide|claude-code|cursor|skills","MIT License",2
"labmlai","annotated_deep_learning_paper_implementations","Python",67002,6722,32,2132,"🧑‍🏫 60+ Implementations/tutorials of deep learning papers with side-by-side notes 📝; including transformers (original, xl, switch, feedback, vit, ...), optimizers (adam, adabelief, sophia, ...), gans(cyclegan, stylegan2, ...), 🎮 reinforcement learning (ppo, dqn), capsnet, distillation, ... 🧠",true,true,true,"https://nn.labml.ai","attention|deep-learning|deep-learning-tutorial|gan|literate-programming|lora|machine-learning|neural-networks|optimizers|pytorch|reinforcement-learning|transformer|transformers","MIT License",156
"apache","echarts","TypeScript",66685,19805,1609,4833,"Apache ECharts is a powerful, interactive charting and data visualization library for browser",true,true,true,"https://echarts.apache.org","apache|canvas|charting-library|charts|data-visualization|data-viz|echarts|svg|visualization","Apache License 2.0",4
"rtk-ai","rtk","Rust",66587,4119,1394,156,"CLI proxy that reduces LLM token consumption by 60-90% on common dev commands. Single Rust binary, zero dependencies",true,true,true,"https://www.rtk-ai.app","agentic-coding|ai-coding|anthropic|claude-code|cli|command-line-tool|cost-reduction|developer-tools|llm|open-source|productivity|rust|token-optimization","Apache License 2.0",1
"D4Vinci","Scrapling","Python",66488,6562,10,622,"🕷️ An adaptive Web Scraping framework that handles everything from a single request to a full-scale crawl!",true,true,true,"https://scrapling.readthedocs.io/en/latest/","ai|ai-scraping|automation|crawler|crawling|crawling-python|data|data-extraction|mcp|mcp-server|playwright|python|scraping|selectors|stealth|web-scraper|web-scraping|web-scraping-python|webscraping|xpath","BSD 3-Clause ""New"" or ""Revised"" License",1
"scikit-learn","scikit-learn","Python",66488,27120,2096,5793,"scikit-learn: machine learning in Python",true,true,true,"https://scikit-learn.org","data-analysis|data-science|machine-learning|python|statistics","BSD 3-Clause ""New"" or ""Revised"" License",0
"leonardomso","33-js-concepts","JavaScript",66486,9168,2,2853,"📜 33 JavaScript concepts every developer should know.",true,true,true,"https://33jsconcepts.com/","angular|concepts|es6|es6-javascript|hacktoberfest|javascript|javascript-closures|javascript-engines|javascript-programming|nodejs|primitive-types|programming|react","MIT License",21
"xtekky","gpt4free","Python",66464,13571,4,1186,"The official gpt4free repository | various collection of powerful language models | opus 4.6 gpt 5.3 kimi 2.5 deepseek v3.2 gemini 3",true,true,true,"https://t.me/g4f_channel","chatbot|chatbots|chatgpt|chatgpt-4|chatgpt-api|chatgpt-free|chatgpt4|deepseek|deepseek-api|deepseek-r1|gpt|gpt-4|gpt-4o|gpt4|gpt4-api|language-model|openai|openai-api|openai-chatgpt|reverse-engineering","GNU General Public License v3.0",1
"Asabeneh","30-Days-Of-Python","Python",66447,12414,160,2412,"The 30 Days of Python programming challenge is a step-by-step guide to learn the Python programming language in 30 days. This challenge may take more than 100 days. Follow your own pace. These videos may help too: https://www.youtube.com/channel/UC7PNRuno1rzYPb1xLa4yktw",true,true,true,"","30-days-of-python|data|data-science|database|flask|fullstack|github|heroku|matplotlib|ml|mongodb|numpy|pandas|python|python3","No License",84
"bradtraversy","design-resources-for-developers","Unknown",66234,12105,49,2243,"Curated list of design and UI resources from stock photos, web templates, CSS frameworks, UI libraries, tools and much more",false,true,true,"","","MIT License",34
"ComposioHQ","awesome-claude-skills","Python",66134,7350,879,253,"A curated list of awesome Claude Skills, resources, and tools for customizing Claude AI workflows",true,true,true,"","agent-skills|ai-agents|antigravity|automation|claude|claude-code|codex|composio|cursor|developer-tools|gemini-cli|mcp|openai-codex|rube|saas|skill|workflow-automation","No License",36
"sindresorhus","awesome-nodejs","Unknown",66079,6226,26,4369,":zap: Delightful Node.js packages and resources [BECAUSE OF TOO MUCH SPAM AND LOW-QUALITY SUBMISSIONS, SUBMISSIONS ARE PAUSED UNTIL JULY]",true,false,true,"https://node.cool","awesome|awesome-list|javascript|list|node|nodejs","Creative Commons Zero v1.0 Universal",55
"earendil-works","pi","TypeScript",66009,8062,43,322,"AI agent toolkit: unified LLM API, agent loop, TUI, coding agent CLI",true,true,true,"","","MIT License",0
"TheAlgorithms","Java","Java",65935,21217,13,3633,"All Algorithms implemented in Java",true,false,true,"","algorithm|algorithm-challenges|algorithms|algorithms-datastructures|data-structures|hacktoberfest|java|search|sort|sorting-algorithms","MIT License",0
"webpack","webpack","JavaScript",65851,9347,175,5222,"A bundler for javascript and friends. Packs many modules into a few bundled assets. Code Splitting allows for loading parts of the application on demand. Through ""loaders"", modules can be CommonJs, AMD, ES6 modules, CSS, Images, JSON, Coffeescript, LESS, ... and your custom stuff.",true,true,true,"https://webpack.js.org","amd|build-tool|commonjs|compiler|es2015|es6|esm|javascript|javascript-compiler|javascript-modules|loaders|module-bundler|plugins|web|web-performance|webpack","MIT License",0
"gorhill","uBlock","JavaScript",65817,4192,17,4105,"uBlock Origin - An efficient blocker for Chromium and Firefox. Fast and lean.",true,true,true,"","blocker|browser-extension|chromium|firefox|javascript|ublock|ublock-origin","GNU General Public License v3.0",1
"BurntSushi","ripgrep","Rust",65527,2615,203,3760,"ripgrep recursively searches directories for a regex pattern while respecting your gitignore",true,false,true,"","cli|command-line|command-line-tool|gitignore|grep|recursively-search|regex|ripgrep|rust|search","The Unlicense",6
"kelseyhightower","nocode","Dockerfile",65435,4822,4714,3063,"The best way to write secure and reliable applications. Write nothing; deploy nowhere.",true,true,true,"","","Apache License 2.0",689
"facebook","docusaurus","TypeScript",65417,9945,372,3294,"Easy to maintain open source documentation websites.",true,true,true,"https://docusaurus.io","documentation|hacktoberfest|javascript|open-source|react|website","MIT License",1
"lydiahallie","javascript-questions","Unknown",65317,9215,52,2572,"A long list of (advanced) JavaScript questions, and their explanations :sparkles:  ",true,true,true,"","","MIT License",692
"localstack","localstack","Python",65077,4742,0,3532,"💻 A fully functional local AWS cloud stack. Develop and test your cloud & Serverless apps offline",true,true,true,"https://localstack.cloud","aws|cloud|continuous-integration|developer-tools|localstack|python|testing","Other",96
"kdn251","interviews","Java",65033,12892,120,3420,"Everything you need to know to get the job.",true,true,true,"https://www.youtube.com/channel/UCKvwPt6BifPP54yzH99ff1g?view_as=subscriber","algorithm|algorithm-challenges|algorithm-competitions|algorithms|coding-challenge|coding-challenges|coding-interview|coding-interviews|interview|interview-practice|interview-prep|interview-preparation|interview-questions|interviews|java|leetcode|leetcode-java|leetcode-questions|leetcode-solutions|technical-coding-interview","MIT License",411
"prometheus","prometheus","Go",64802,10535,850,4963,"The Prometheus monitoring system and time series database.",true,true,true,"https://prometheus.io/","alerting|graphing|hacktoberfest|metrics|monitoring|prometheus|time-series","Apache License 2.0",0
"alacritty","alacritty","Rust",64694,3497,340,3782,"A cross-platform, OpenGL terminal emulator.",true,false,true,"https://alacritty.org","bsd|gpu|linux|macos|opengl|rust|terminal|terminal-emulators|vte|windows","Apache License 2.0",5
"gsd-build","get-shit-done","JavaScript",64558,5473,0,195,"A light-weight and powerful meta-prompting, context engineering and spec-driven development system for Claude Code by TÂCHES.",true,true,true,"","claude-code|context-engineering|meta-prompting|spec-driven-development","MIT License",27
"LadybirdBrowser","ladybird","C++",64328,3076,509,758,"Truly independent web browser",true,false,true,"https://ladybird.org","browser|browser-engine","BSD 2-Clause ""Simplified"" License",0
"openinterpreter","openinterpreter","Rust",64148,5571,272,1079,"A lightweight coding agent for open models like Deepseek, Kimi, and Qwen",true,false,true,"http://openinterpreter.com/","coding-agent|deepseek|interpreter|kimi|qwen|rust|tui","Apache License 2.0",7
"keras-team","keras","Python",64096,19744,212,4110,"Deep Learning for humans",true,true,true,"http://keras.io/","data-science|deep-learning|jax|machine-learning|neural-networks|python|pytorch|tensorflow","Apache License 2.0",0
"cline","cline","TypeScript",63957,6788,1172,721,"Autonomous coding agent as an SDK, IDE extension, or CLI assistant.",true,true,true,"https://cline.bot","","Apache License 2.0",0
"code-yeongyu","oh-my-openagent","TypeScript",63813,5218,722,206,"omo/lazycodex: The coding agent for tokenmaxxers;the one and only agent harness for complex codebases. For your Codex, for your OpenCode",true,false,true,"https://omo.dev","ai|ai-agents|anthropic|chatgpt|claude|claude-skills|codex|cursor|gemini|ide|openai|opencode|orchestration|tui|typescript","Other",0
"traefik","traefik","Go",63753,6050,839,3940,"The Cloud Native Application Proxy",true,true,false,"https://traefik.io","consul|docker|etcd|go|golang|kubernetes|letsencrypt|load-balancer|marathon|mesos|microservice|reverse-proxy|traefik|zookeeper","MIT License",1
"nocodb","nocodb","TypeScript",63642,4881,660,3163,"🔥 🔥 🔥 A Free & Self-hostable Airtable Alternative",true,true,true,"https://nocodb.com","airtable|airtable-alternative|automatic-api|hacktoberfest|low-code|no-code|no-code-database|no-code-platform|postgresql|rest-api|restful-api|spreadsheet|sqlite|swagger","Other",0
"ryanoasis","nerd-fonts","CSS",63511,3911,78,4222,"Iconic font aggregator, collection, & patcher. 3,600+ icons, 50+ patched fonts: Hack, Source Code Pro, more. Glyph collections: Font Awesome, Material Design Icons, Octicons, & more",true,true,true,"https://NerdFonts.com","font|font-awesome|fonts|hacktoberfest|icon-font|iconic-fonts|octicons|patched-fonts|patcher|powerline|python|shell|statusline","Other",102
"rust-lang","rustlings","Rust",63382,11214,40,3938,":crab: Small exercises to get you used to reading and writing Rust code!",true,false,true,"https://rustlings.rust-lang.org","beginner-friendly|exercises|rust|rustlings","MIT License",4
"socketio","socket.io","TypeScript",63201,10153,177,5952,"Bidirectional and low-latency communication for every platform",true,true,true,"https://socket.io","javascript|nodejs|socket-io|websocket","MIT License",2
"dani-garcia","vaultwarden","Rust",62995,2948,61,3052,"Unofficial Bitwarden compatible server written in Rust, formerly known as bitwarden_rs",true,false,true,"","bitwarden|bitwarden-rs|docker|rocket|rust|vaultwarden","GNU Affero General Public License v3.0",22
"tldr-pages","tldr","Markdown",62970,5323,299,4584,"Collaborative cheatsheets for console commands 📚.",true,true,true,"https://tldr.sh","android|bsd|cheatsheet|cheatsheets|cli|command-line|console|documentation|examples|hacktoberfest|help|linux|macos|man-page|manual|osx|shell|terminal|tldr|windows","Other",0
